index,year,month,day,content,likecount,nickname,user_id
1,2019,11,23,他说的是这个歌,0,虎生-,132651447
2,2019,11,19,拆迁户的生活,2,暗堂龙烈,382338807
3,2019,11,18,那时还在复读，中国青年政治学院篮球场旁的宿舍里，通过887听到的。好好干，一切都会好起来的！,0,维克多上校,31430179
4,2019,11,14,铁风筝乐队主唱虞洋的作品之一。,3,馬叁匹,35491961
5,2019,11,12,今天突然发现词曲是虞洋作的。无法把《这个夏天》跟这首歌联系起来[呲牙][呲牙][呲牙],2,我的名字叫红叶,60012153
6,2019,11,11,我的cp又在暗戳戳发糖了,1,遑论是非,346599961
7,2019,11,11,我觉得这是大户型民宿最好的宣传广告曲了,2,wheator,94526747
8,2019,11,9,真实,0,pamelaal,582546386
9,2019,11,9,问姐来的,0,在听音乐y,389978529
10,2019,11,9,我也想跻身富人区55555,2,软灰鲨鱼,54662727
11,2019,11,8,都是回忆啊,0,Aurorapuya,394001301
12,2019,11,3,对。其实还是反响不错的，只是销量不如Stefanie。,0,blueberrypie,41491137
13,2019,11,3,哈哈哈哈哈哈哈哈哈哈哈,0,blueberrypie,41491137
14,2019,11,3,刚出来我就喜欢这首歌😌😌😌不一样的孙燕姿！！！！！,0,blueberrypie,41491137
15,2019,11,3,80年代的我哥，光盘里存的第一首歌，00后的我，记得孙燕姿，从这里开始,0,大圣的小猴王,636297630
16,2019,11,1,现在这个心愿成了奢求,0,一個人滴精彩,576379044
17,2019,10,25,同龄人，祝福一切都好[开心],0,三斤葡萄十块,44136316
18,2019,10,24,2005年大一新生的我，从宿舍走到家乐福半个小时，只为去CD试听区，戴上那的大耳麦听《完美的一天《……现在想想，那时的我真是穷得快乐！！～,1,潇声客,48537084
19,2019,10,24,2005年大一，咱俩一届的，当时在家乐福CD试听区带着耳麦听了这歌好几天，因为没钱买！！～,0,潇声客,48537084
20,2019,10,23,有很大的落地窗户,2,Qir19496,382960189
21,2019,10,20,学校铃声！！！！[可爱],3,一碗火锅涮羊肉,535028858
22,2019,10,19,燕姿05年就让你买房了！你把握住了吗[大哭],3,胡郎远,102221229
23,2019,10,16,什么歌单啊,0,訾央伪装小漠漠,247480354
24,2019,10,16,这房子最少2000w,4,空生妙有lake,404134703
25,2019,10,11,当年第一次听到这首歌，我就很喜欢，现在仍然很想要这样的大房子,2,懒懒得烂烂,1514080244
26,2019,10,11,这词有点像种太阳…一个种在北极，一个种在夜晚,1,桃子亚麻P的sweetie,137653121
27,2019,10,11,我很爱这个歌词，你不觉得这个歌词很有意境吗？,0,相信iii,289209789
28,2019,10,11,哈哈,0,仙仙miss,409265746
29,2019,10,11,这个歌词，瞎写的吧。,0,侃大山com,1643917426
30,2019,10,11,厉害了，眼光毒辣，一下子就看到了房价的趋势，还写成歌广而告之,0,WaitingForYou_u,1510390454
31,2019,10,11,阳光洒在地板上，也温暖了我的被子❤,1,倚着阳光说爱你,262512490
32,2019,10,11,做梦吧,1,Deekson,100202078
33,2019,10,9,第一次听这歌的时候，还不懂什么叫飘窗[多多瞌睡][多多瞌睡][多多瞌睡][多多瞌睡],0,哼你好笨,630332990
34,2019,10,8,14岁快乐,1,孙燕姿老龚,405006132
35,2019,10,7,今天发行14 周年,0,错生不错过,422192437
36,2019,10,7,小时候的梦想,0,皮卡皮卡皮卡皮卡丘丘丘丘,279369552
37,2019,10,7,这一张是我的心头好啊,1,朱一金,626735320
38,2019,10,3,她发微博了，今天很完美,0,这个名字找不到我吧,1694668944
39,2019,10,2,老哥没看当时在亚洲多火吧 什么被低估...是被大陆市场低估吧,1,so_fly,127250352
40,2019,9,29,我也是哈哈哈哈哈,0,梦想当个蒙特利打工仔,335815757
41,2019,9,26,燕姿唱得大房子就是我梦想中的房子,2,魔力音乐馆,109387131
42,2019,9,23,好大的房子 好多的房间 富婆的快乐 呜呜 小时候听歌都不是这种感觉 越长大越现实啊,3,意达哟,71599944
43,2019,9,20,听了这么多年，今天才知道是“要”不是“有”，我每次都唱“我🈶一所大房子”，心情好好😂😂😂😂,3,玫瑰铁架,477080350
44,2019,9,20,我们晚上不睡觉。白天在床上思考。,1,也不是猪只打呼,355734135
45,2019,9,19,噜啦啦啦啦啦,0,只爱Mark,60751750
46,2019,9,15,燕姿很超前的！吹！,0,够不够暖活你1993,318608250
47,2019,9,14,我只要最快的网路,0,我放的屁逗是香的不信你闻,23149297
48,2019,9,13,我也想要一所大房子,0,嘿小hou的世界,16335939
49,2019,9,11,炫富神歌,1,SuZixiong,2555016
50,2019,9,8,朋友哭晕在厕所，朋友也想要大房子[大哭],0,zincl,107587264
51,2019,9,2,真的好想要一所大房子,0,正青春掉光了头发,427785297
52,2019,9,1,面朝大海，春暖花开,0,逍遥津大力丸,53553884
53,2019,8,30,这歌挺火的啊,0,快送我出家,302527318
54,2019,8,25,你是为啥觉得姿妈不红[大哭],0,只是浅蓝,294556642
55,2019,8,22,房奴之歌,1,SleeplessNight,107491792
56,2019,8,19,初中的时候，学校放学会放的这首歌，伴随着歌声跟朋友说笑打闹着出校门，就感觉很开心,1,道理都懂就是懒,395018441
57,2019,8,18,现在听才有感觉,0,还要上学吗,53518676
58,2019,8,17,北漂每天夏天搬家  都是听着这歌气哭[惶恐],1,Lolalolo,277830234
59,2019,8,16,当时要是听懂这个歌，现在都不用上班了,4,桂中著名狠人,1781226752
60,2019,8,14,看到你的评论我也去查了一下哈哈哈哈哈,0,苑子潯的小号,1548957065
61,2019,8,13,印象还是蛮深刻。总的来说，从网易云找的回忆不算少。到了年纪吧。,0,Make1956,2546486
62,2019,8,13,我们晚上不睡觉～,0,Kepler小姿,342372326
63,2019,8,12,我正好本命年准备买房子 因为经济以及各种压力 我还是不想将就自己买领包入住的二手房 希望自己找到其他赚钱的渠道,1,给你一打神经病,318443123
64,2019,8,9,我要一所大房子，有很大的落地窗户，阳光洒在地板上，也温暖了我的被子。       这是我小时候的愿望，后来发现这几乎不能实现,2,一枚安静的闲人,255828361
65,2019,8,8,历史老师的手机铃声😂😂😂,3,doodoochole,471680567
66,2019,8,7,这首歌真的很棒，唱出了女生心中理想的生活世界~,2,南倚竹林小桥,416330431
67,2019,8,7,梦想中的生活方式,2,南倚竹林小桥,416330431
68,2019,8,6,我要一所大房子 有很大的落地窗户！,1,莫名____z,1896679583
69,2019,8,6,突然想起来这首歌，查了一下这个虞洋，华语乐坛原来还有这样真实的人物。,0,川山与共,105802738
70,2019,8,3,我觉得不红一大半原因是以前播放器音质不好,0,星川浩海,35779720
71,2019,8,3,"No,180平最多做到三室两卫，起码要460平联排或者独栋，才能到6室，还不一定客厅大，",4,让让123,38779877
72,2019,8,3,工资每天五毛,0,让让123,38779877
73,2019,8,3,买得起,0,让让123,38779877
74,2019,8,3,蒂花之秀好朋友,0,让让123,38779877
75,2019,8,2,占位,0,HRDD1010被谁注册了,636757026
76,2019,8,1,那位很喜欢这首歌，我把她丢了，一直忘不掉，我想找到她想让她看见，希望能把我送上去。,0,Cissy_zcb,90379350
77,2019,7,29,《完美的一天》作为整张专辑的第一主打，并不像孙燕姿一贯的风格，由创作人虞洋作词作曲的音乐作品，让人们听见可爱又有个性、正在做白日梦的女生。这也是第一次在孙燕姿的专辑中出现内地音乐人的作品。,1,识刀客,623315109
78,2019,7,28,最少六居室[呲牙],0,时光里的影子_时光里的墙和人,105207488
79,2019,7,27,车祸现场，你说的太委婉了,0,飞流-三千,1572289778
80,2019,7,27,初听不识曲中意，再听已成曲中人。现在买不起房了吧？,2,飞流-三千,1572289778
81,2019,7,27,好了知道你有房了，好了好了知道了,3,飞流-三千,1572289778
82,2019,7,26,广州买房子啦~,0,迷鹿已,130523323
83,2019,7,24,因为这是铁风筝乐队主唱写的[大笑],1,米国有个华莱士,89415178
84,2019,7,24,不牛批就不叫十三姐了 😂,2,苑子潯的小号,1548957065
85,2019,7,23,这歌我记得好像是铁风筝乐队主唱给写的。,3,艾晓希MEW,269508320
86,2019,7,23,这首是我爱上燕姿的启蒙歌，原来在我初中的时候燕姿就要我买房子了[流泪]可惜我不听话......,2,外套在哪里,1436632203
87,2019,7,22,无力奔跑[呲牙],1,霉头霉脑云散月现自在飞花slay,42294326
88,2019,7,22,这首歌有很强的未来感,2,小SSSS小,128599827
89,2019,7,20,不奢求大房子，够一个人生活就行,3,识刀客,623315109
90,2019,7,19,那个年代买了就是赚到啊,1,窗子罐头,129089531
91,2019,7,19,护蛋比赛哈哈~温馨,0,研L漫漫,379305574
92,2019,7,19,05年，北四环的房子才1万，而今8万+。是什么让我们如此贫穷，是听不懂燕姿。,7,章yu章,543331521
93,2019,7,18,第一次知道这首歌，是小学在姥姥家看那种小方块电视，偶然看到报道介绍，写这首歌时，公司专门做了一个四面都是玻璃的房子，外面的人都可以看到里面😂印象深刻，一直以为这首歌叫我要一个很大的房子，原来叫完美的一天啊[大笑],1,住在我耳朵里吧,119189133
94,2019,7,18,我也想要大房子,0,喵味西瓜籽,417980601
95,2019,7,18,太好听捏，很真实,1,天空柘汪,575304613
96,2019,7,14,评论笑死我啊,1,霉头霉脑云散月现自在飞花slay,42294326
97,2019,7,14,笑死了,0,霉头霉脑云散月现自在飞花slay,42294326
98,2019,7,13,卡,0,Chertime,83946830
99,2019,7,11,来听听燕姿14年前的专辑啦[可爱],0,听歌使我快乐喔,399543214
100,2019,7,9,我姿就是牛 晚上不睡觉白天还能在床思考 换我只能在床上打呼,7,Hilomn,287325445
101,2019,7,7,哈哈哈哈哈哈,0,阿兔兔_77,91432274
102,2019,7,6,配合mv食用更佳哦,0,一只鸭鸭梨,1354842580
103,2019,7,6,最喜欢的就是这首歌，k歌最擅长的却是眼泪成诗和开始懂了😌～,0,xxxsandra,343717702
104,2019,7,6,小学时候，拿VCD放光盘里的歌。。,0,挚破孤独,392115492
105,2019,7,4,[多多捂脸][多多捂脸][多多捂脸],1,Mr繁星,2757769
106,2019,6,30,一个房间住朋友和他的爱人——是一间房住一对吗？这怕是要买酒店才行了吧。,0,恺慎,1795036965
107,2019,6,30,有很大的落地窗户，阳光洒在地板上，就是小幸福了吧~,0,哲理的紫色童心,107095120
108,2019,6,28,我听出了王菲的感觉,1,苍老小孩,39117340
109,2019,6,27,我听的燕姿第一首歌就是《完美的一天》当时只觉得MV中的她好活泼好阳光、[亲亲],5,天使恋之吻,1454898411
110,2019,6,26,我要一个女朋友,1,不要关掉我的音乐,68830456
111,2019,6,26,安得广厦千万间,3,Eminoparte,77208914
112,2019,6,24,小时候听磁带的歌，这么多年后来这里听[可爱],2,窗纸with振翅,44216947
113,2019,6,24,？？？小时候就超喜欢这首,1,关爱窦吹成长协会,263701157
114,2019,6,22,高中每次广播播放英语听力之前总是会放这首歌，也是我第一次听，觉得很好听，导致每次做听力都很兴奋，一点都不瞌睡[大哭],1,素履之往不凡人生,344576245
115,2019,6,21,我要一个男朋友~,1,Nino酱了个酱,395290978
116,2019,6,19,我感受到了阳光，沙滩，甚至还有仙人掌,3,全黑噢耶,304720287
117,2019,6,18,刚从文蔚的《他不爱我》出来、结果是燕姿这个、好吧、哭过就来庆祝完美的一天[爱心]加油、新开始,0,天使恋之吻,1454898411
118,2019,6,18,上海买房子啦,3,iTAPIR,247754394
119,2019,6,18,小时候家里光盘💿里的歌～当年很喜欢,0,今夕今夕是何年,313693171
120,2019,6,17,秀,1,文鼎九州,135880083
121,2019,6,17,歌曲名：宅男宅女,4,文鼎九州,135880083
122,2019,6,17,我第一次是从收音机里听到的，主持人说这首歌相比燕姿其他的歌没有那么出名，但也是非常好听的一首歌。第一次就听出了那种阳光的味道。,1,禛安,569868616
123,2019,6,15,这首歌真是符合田馥甄,2,灵魂伴侣提词器,1637673028
124,2019,6,15,真是很完美的一天，生命里出现多少次这样的一天，才会觉得人生圆满了。,0,我听迷忘,397850376
125,2019,6,14,几年前听 就只觉得欢快 阳光 现在再听 燕姿还有钱 这么大房子 这么多房间 我也想要啊 [大哭],1,意达哟,71599944
126,2019,6,12,5G标准要出来了，最快网路的房间赶快部署起来！,2,seven0413,86590420
127,2019,6,12,大房子有多大？又有很多的落地窗户[大笑],0,短腿的长颈鹿先生,12866064
128,2019,6,12,这得是别墅啊！,2,小小笑哈哈哈,1534378855
129,2019,6,11,我有套房就乐了，小点也没关系[大哭],1,H-Scorpio,34795379
130,2019,6,11,出来的时候我想说，这是什么玩意歌曲。,2,tayVin,46867967
131,2019,6,7,我要一所大房子[流泪][流泪][流泪][流泪][流泪][流泪][流泪][流泪],0,蛋黄奶,135096685
132,2019,6,5,每个人要的都不同，也许我要的完美并不是你的,1,lee19871212,632119923
133,2019,6,3,小的时候偷偷用诺亚舟学习机偷偷在被子里听,1,代雨龙,6968335
134,2019,5,31,刚出来我超爱的！,2,请多指教MrHuang,75472588
135,2019,5,30,扎心,0,萌萌的Gavin,82864828
136,2019,5,30,当时听懂这首歌的粉丝都已经家财万贯了。,4,铁路骑侠,364140708
137,2019,5,28,我们根本就是同一类人 是不是,0,帐号已注销,107776245
138,2019,5,26,哈哈，当时听到这句，疑车无据，晚上不睡觉，,1,用户529066821,529066821
139,2019,5,25,晚上不睡觉，白天在床上思考。才是吧！,16,可以给我一杯冰阔落吗,422706110
140,2019,5,24,同感，真的超级像[汗],0,莉悳小世界,477516730
141,2019,5,24,一个房间住着朋友和她的爱人，我们晚上不睡觉，哈哈,1,顾辞远爱林逸舟,402136864
142,2019,5,24,大概是起床后立马就想听的歌，英姿飒爽和世俗拧着过，想怎样就怎样放眼星辰大海！,1,素颜朝面,1336101490
143,2019,5,23,＋1嚯嚯哈哈哈哈哈哈,0,单骉猋,1484966094
144,2019,5,23,没人觉得唱作人白安的那首什么孩子的和这首超像嘛 [口罩],1,X-precious,49888779
145,2019,5,21,那个牌子是正版，我有美卡和不知道什么牌子印着华纳音乐正版授权,2,忘川巫,1341405275
146,2019,5,20,主要看地段[大哭],5,小鹿的光,105173205
147,2019,5,19,越听越好听系列，第一次听会觉得不是燕姿的风格不适应，听多了真的是很喜欢,0,沫沫Bao,541275220
148,2019,5,18,俩猫在屋里嬉闹，度过完美的一天,0,Dora王令,87799975
149,2019,5,17,阳光洒进房间，刚好照在了脸上，这是一天中最美好的时光了,1,属于太阳的月亮,1717701672
150,2019,5,17,小时候听这首歌不明白要那么多房间干啥，现在懂了。我也要,1,张多金zzZ,378001389
151,2019,5,17,红色！短发！,0,DogeDo9,34719885
152,2019,5,16,当年房价还不高,0,懒人帆帆,496710350
153,2019,5,14,第一个窗户（仓库）发音不对啊，后面窗户发音都对了,0,当梨子,1352528191
154,2019,5,13,绝了,0,还要多久呐,555729225
155,2019,5,13,好多年没租到过落地窗的房子啦[憨笑],0,黑灰机,28817304
156,2019,5,12,现在媒体都一样，曲风多元说接受不了，风格统一又是没突破,0,放开那个呆子,982704
157,2019,5,11,小时候因为这首歌，对落地窗户一直充满向往,1,心人戈,1695108876
158,2019,5,8,蒂花之秀不及汝之秀,16,核桃星人,613020805
159,2019,5,8,当年在饭店吃饸络的时候电视上放的，那时候还没入坑[多多比耶],0,麻衣雅嘿,129499875
160,2019,5,3,随机播放到这首，聒噪的音符跳动起愉悦感，“‘我们晚上不睡觉，白天在床上思考’这不是精神病人的生活”阿雯说，随即不约而同大笑起来……原来心底的那份童真，是被自己打破的[心碎],3,绿子-----,444875432
161,2019,5,2,后者LOW上天了。哪里像,1,天使恋之吻,1454898411
162,2019,5,1,已经买了😊,0,小小de寄己,591309351
163,2019,4,30,"不用大房子 现在只想有个小房子
也不用有落地窗户 只要朝阳 阳光能照得进来
也不需要有小狗和吉他 有个小音箱能听歌就好 最好也能有个小冰箱 能存点吃喝的
在我不想回家 也不想进宿舍的时候可以冷静的待一待",3,就是forever啊,429574842
164,2019,4,29,小时候听的时候，觉得歌词奇怪。之后一直记得，现在慢慢懂得这些愿望很难得,5,韶乐帝姬,455081640
165,2019,4,28,这首歌是我听的燕姿第一首歌,1,天使恋之吻,1454898411
166,2019,4,28,听说你喜欢谁，你就会越来越像谁。我也会成为燕姿这样独立有思想又有童真的女孩子吧,2,曼城雨季,109528571
167,2019,4,27,我们晚上不睡觉那句开始仿佛进入了清澈又温暖的新世界,2,江江lu,404998672
168,2019,4,26,看到这条突然心酸,0,JamesMcAvoy,32617670
169,2019,4,26,而且告诉大家快去买大房子！,16,JamesMcAvoy,32617670
170,2019,4,26,"要有电影 音乐 小猫小狗 鲜花 香水 还有爱人 可以不用多大的房子
但是一定以上都得有",2,CocoRosie10,1680938709
171,2019,4,24,第一句就让我想起了雅思的口语考题哈哈 ideal house,2,ElodYYYY,348539511
172,2019,4,24,不过勇气还是可嘉的,0,无糖菠萝,125737568
173,2019,4,24,"翻唱得一言难尽 不知道为什么
支持孙燕姿",0,天使恋之吻,1454898411
174,2019,4,23,我同事说，他老婆天天给他放这首歌，压力好大,7,Smalltwo777,274401939
175,2019,4,23,理想生活之歌聽了十幾年  落地窗戶都沒有 更別說大房子了,0,吞下一大口云,37397254
176,2019,4,22,听着这首，大房子，就感觉自己住进了这样一所大房子。竟然不由得飘了起来。,2,莫名惊恐,26125199
177,2019,4,22,可能这就是大房子这么受欢迎吧！,0,莫名惊恐,26125199
178,2019,4,22,我05年大一，在农村长大，第一次出远门，第一次坐火车，一个人揣着学费，生怕被人偷了[开心][开心],2,容差,299198932
179,2019,4,22,不，你不要,0,滴滴哩哒,1397751044
180,2019,4,22,我要,0,滴滴哩哒,1397751044
181,2019,4,21,这首歌的词曲作者是铁风筝乐队的主唱虞洋,3,用户41965267,41965267
182,2019,4,17,当年刚出时候买了专辑，然后听到这首觉得好难听，好二。后来真的是越听越喜欢[大笑],2,啥时候能醒呢,98651703
183,2019,4,14,燕姿没有拿不出手的专辑。《完美的一天》绝对是被低估的专辑。,1,9号天台,53103092
184,2019,4,14,太超前，跟情歌不一样就没有被当时的市场认可,21,9号天台,53103092
185,2019,4,8,虽然我完不成这么多条但我至少还是完成了其中一条：我们晚上不睡觉。都TM加班,2,以下均为真话,116038256
186,2019,4,4,这是一首房地产广告歌曲~~,2,id_skyline,63904375
187,2019,4,2,我还是没有告别暗淡生活，这么多年了……,2,NovaXyz,122018966
188,2019,3,29,嗯,0,桃奈水水,492606985
189,2019,3,29,"一顿3个人的火锅；
2场和2个不同人看的电影；
四杯红茶；
一份还算满意的化验单；
一通55分14秒的深夜通话；
一个是相识13年；
一个是同桌同寝的兄弟；
一个是深夜可以倾诉的人；
一个是偷偷喜欢的人；
完美的一天",6,杨-老八,120709623
190,2019,3,27,我正在酝酿一所自己的小房子😄加油加油,5,小小de寄己,591309351
191,2019,3,26,嗯，书名偶遇，作者陈鲁豫,0,怡红院的至尊宝,1317184106
192,2019,3,26,所以什么时候睡觉,1,做你的噩梦,1307427818
193,2019,3,23,我初中的时候超级想染个红头发，也想把头发剪得和她一样短。,0,水清浅zl,593345876
194,2019,3,22,歌词很好,0,Yilla_,1392536484
195,2019,3,22,是呀！！,0,蒋丞给我跳社会摇,449973500
196,2019,3,21,头像是康纳酱？,0,There_is_no_joke,424102898
197,2019,3,19,以前还可以幻想过这种日子，现在想都不敢想了。,0,你喔嘻嘻,89407990
198,2019,3,17,看出来了...湄江的？,0,蒋丞给我跳社会摇,449973500
199,2019,3,17,一定可以的[憨笑],0,梅菜扣肉OvO,73709058
200,2019,3,17,05年的時候，剪著和燕姿一樣的短髮，很多學弟學妹說我像她，我回 那我應該是發福版的燕姿吧。哈哈哈哈~ ,1,3X_Z3,131027986
201,2019,3,16,05年初二就梦想有间带落地窗的大房子，一晃2019年了，还住在帝都郊区的小公寓里，一个字惨,0,嘻嘻有个朋友叫哈哈,408725601
202,2019,3,16,小学听过的。,0,听歌小罗,449676831
203,2019,3,16,我们学校放了一周,2,桃奈水水,492606985
204,2019,3,16,没同校的？果然同校玩网易云的好少。。。,0,蒋丞给我跳社会摇,449973500
205,2019,3,14,"真好听",1,吹得很乱的发型,411409768
206,2019,3,14,不对 燕姿的6室至少要400+,3,反反复复人,40500565
207,2019,3,12,再加只猫，人生 赢家了,4,前面那个好香噢,254483941
208,2019,3,12,燕姿家的房子就这个样[鬼脸],6,秋葵炒蛋丫,248446467
209,2019,3,11,这也是我想要的完美的一天[爱心],1,There_is_no_joke,424102898
210,2019,3,5,"你很皮
",10,杨小斌的life,262365096
211,2019,3,2,偶遇,0,肚子和心都是空的,267081740
212,2019,3,2,《有钱人的一天》,4,LeslieKwok_,370355121
213,2019,3,1,2005年秋天去高中的路上听到这张新砖，特别激动,1,s1ck1000,1471605268
214,2019,3,1,这首歌和《如果有一天我变得很有钱》的风格很像~,0,RoyIssing,1312362595
215,2019,2,27,看《偶遇》而来,1,怡红院的至尊宝,1317184106
216,2019,2,24,已经被歌词给洗脑呢，完全就是神仙生活。,0,漫时光_Mandy,362649799
217,2019,2,24,同城,0,节南-,490666915
218,2019,2,23,从田馥甄那边传送过来的，插个眼,5,不知名闲人-,328836864
219,2019,2,22,坐标：武汉   下了一个月的雨🌧️，终于放晴了，一边上班一边带着耳机狂欢～ 从来没有比现在如此热爱过灿烂阳光,3,仰望蓝天123,113124350
220,2019,2,21,小学六年级在班级上唱了这首歌，然后转学，十二年过去了，与小学同学相聚，他们还记得我唱的这首歌，哈哈哈哈,0,冢翬,585426869
221,2019,2,20,为什么要打这首歌,0,卑华,599475028
222,2019,2,18,风铃不要太赞[色],2,润小泽Ronny,1326160889
223,2019,2,17,当年这张专辑出来的时候，燕姿面临非常大的非议，都说这张专很差劲，转型失败等等，媒体基本是一面倒的批评。在我看来，这首歌有第一天，HONEY HONEY，还有梦不落，我完全无法理解为什么他们要非议燕姿。这张专辑在燕姿所有专辑里不算最出色的，但绝对也是燕姿拿得出手的。现在想起来，我依然很气愤。,12,Nembutal,285968582
224,2019,2,16,突然想起了这首歌。听的时候还在读小学，现在都大学毕业三年。我也想要一个大房子🏠[大哭],3,梦若须臾长,273842410
225,2019,2,16,好想听你的演唱会~,0,小冀崽崽,455717392
226,2019,2,16,准备在无锡买房子了，我是苏北狗[亲亲][亲亲][亲亲],2,本田变AMG,326024298
227,2019,2,16,大房子🏠,0,暮至明,94756999
228,2019,2,14,有多少人是从田馥甄歌单点进来的,1,同桌的酷同桌,1652729937
229,2019,2,13,你就是呀,0,Sukuz,41793678
230,2019,2,12,06年末我的大学生活接近尾声，工作都找好了，偏偏让我遇见了她，唉！那一年，生活原本有无数种可能,3,钢城夏天的风,473386474
231,2019,2,10,比我大一点点，我05刚上高一，记得当时是秋天，骑着自行车去上学，看着西边空中的晚霞，听着完美的一天。那种兴奋不已的感觉现在还记得,5,s1ck1000,1471605268
232,2019,2,6,新的一年，凑个2019吧,3,阴山之上,262879747
233,2019,2,6,再加两个评论到我就是2019啦！,0,千与千寻之起风了,414873860
234,2019,2,5,第一次听到这首歌是在我上小学的时候，当时第一感觉就是很前卫,0,账号注销成功,42340962
235,2019,2,2,大房子～大被子！一个人住也没意思[呲牙],3,七彩男花豆,81480732
236,2019,1,30,至理名言,0,用户70970626,70970626
237,2019,1,28,这首歌当初被低估的最大原因，大概归咎于播放设备的音质。,2,帐号已注销,79215208
238,2019,1,26,在大房子里，晚上为什么不睡觉😏！,0,雪国726,405859156
239,2019,1,22,完美的一天真的被低估了，专辑里有好多好歌,0,YZKEPLER,42348015
240,2019,1,21,我听的重点是在大的落地窗户,0,遇见未知的自己Aurora,473849783
241,2019,1,21,09年我还在用磁带听，那时候MP3都快过时了吧…想起来当时真的low…,0,花莫笑丶,514517742
242,2019,1,17,整个小学 学校都放这首歌,0,阿菲林阿,121798188
243,2019,1,15,我们晚上不睡觉 白天在床上思考 多么完美的一天？？？ 会不会死？,5,二trust,128458738
244,2019,1,13,我以为叫房子，找了好久,3,山敲木鱼石,366645232
245,2019,1,12,这一年，15岁，初恋，他告白的那晚，天空繁星点点,5,Tochmusic,77968415
246,2019,1,10,30前的每一天 的来,0,啊荷尔萌,15647980
247,2019,1,9,“走马观花”这个词无疑是我的命中克星，永远对“过客”“路过”诸类的字眼避之唯恐不及，我生命中的邂逅啊，你放缓远行的脚步，我尚未掌握让你快速认知我的关窍，,1,黑择明Q,60812667
