index,year,month,day,content,likecount,nickname,user_id5106,2016,2,20,不知道现在遇到的你是不是那个对的你,4,兔兔兔兔_tu,124701172
5107,2016,2,20,就是你啊，李知恩，,1,热爱收拾,81284321
5108,2016,2,20,学校征文，实在不知道该写什么内容，因此来到燕姿歌里找灵感，突然《遇见在左，雨天在右》题目就出来了。。。,4,向往北方的日子和乐子,75903833
5109,2016,2,20,他往事如风  我失色青春的惶恐,2,Frrran,40411964
5110,2016,2,20,我也是真的好怀念,0,mystrings,113814492
5111,2016,2,20,[爱心],1,ShilyR,79610484
5112,2016,2,20,感激一切相遇，感谢上天一切安排。精彩自己，张开怀抱迎接任何形式的未来[爱心] 但是我相信一定是越来越好💪,1,泡泡美酱,101995131
5113,2016,2,20,最喜欢的.,1,拾义,44021459
5114,2016,2,20,[爱心],1,带上耳机听歌,50241249
5115,2016,2,20,你回来了，我走了。,1,momo哩,44566583
5116,2016,2,20,“愿你永远努力，愿你永远被爱。喜欢的都能得到，得不到的都能释怀。”  哈哈，春风十里，不如忘了你。,3,择善而行的章璐的说,64503909
5117,2016,2,20,感觉我前一年就是这个状态，现在正努力的去装下他人[憨笑],1,拥抱你__,49949040
5118,2016,2,20,完了，我睡不着了,4,哎了个开,87643581
5119,2016,2,20,感觉她离我越来越远了。,1,KakaLoveJay,57661667
5120,2016,2,20,过去的一年每一次在火车站分开不懂浪漫的他都会在我进检票口的最后一刻亲一下我的额头，我每一次都哭。我一直想着如果有一天可以的话我们就再也别分开了，但是最后我们还是分开了，那次在车站，你没有牵我也没有亲我，只是重重的在背后捏了一下我的肩膀。后来我才知道，你是在告别。,3,Rache1,9526092
5121,2016,2,19,20160219 自己唱哭自己的歌 咳嗽咳嗽咳嗽 腹部酸痛 听到好听的歌不知道分享给谁除了你 如果你不听的话似乎也没有分享的意义了… 春天的雨水好多 我怀念无数个雨中的自己… “外面起风了”“嗯，我也想你了”,1,hiuhiu酱,105305614
5122,2016,2,19,你听听歌词~,1,寺蜢,106823817
5123,2016,2,19,每一次跟你分开，都是这首歌陪着我，而现在再也不需要了,1,刘晃晃_,135796241
5124,2016,2,19,千万记得天涯有人在等你[爱心],1,study中whoops,48435532
5125,2016,2,19,我的青春都是孙燕姿,1,Tovi,74095
5126,2016,2,19,一首歌伴了我一整个青春[爱心],3,七百六十一,96491911
5127,2016,2,19,愿为你  直到有一刻能守着你的心。,4,MokMeow,110727991
5128,2016,2,19,大学四年，大一到大三她和我一起，不知道她会不会说一句：“尚好的青春都是你”,3,洪十力,5600179
5129,2016,2,19,中学我一度陷入自闭，在楼下的街道却有一个明亮的笑曾照亮了我的整个夏天，让我走出自己的世界，可是毕业后，我找不到你，我想知道你是否安好，却无人与我说,5,谢谢你歌里的故事,91128079
5130,2016,2,19,千万记得天涯有人在等待,2,蓝色头发的水仙花,107513989
5131,2016,2,19,💗,1,就是你的大宝贝呀,48826435
5132,2016,2,19,想想我和师傅终有一别，再也没人罩着我了，眼泪掉下来！哈哈哈！,2,noonee,36765837
5133,2016,2,18,有一种孤独是你能走进别人的心里，而自己的心里再也装不下任何人,1,monsteris,74295464
5134,2016,2,18,这首歌不敢随便听,3,Chellyye,70403491
5135,2016,2,18,要开学了，最后一个晚上好好听歌，高三太忙了，高考胜利,4,风中的花飞了,130951703
5136,2016,2,18,天涯有人在等你，路途再远不要不回来。,1,付小得,48233538
5137,2016,2,18,把想说的话说完，一定要跟着你的心走，别放弃！别后悔！[爱心][爱心][爱心][拜],1,CHE玙萱,95778705
5138,2016,2,18,是石沉大海，是真的还爱,2,帐号已注销,80135165
5139,2016,2,18,有一种孤独是你不可能在任何人心里 而你心里也不可能有任何人,2,帐号已注销,126832172
5140,2016,2,18,高一时候听的歌  那时侯听歌能够有想起的人现在什么也没有  空了,1,帐号已注销,126832172
5141,2016,2,18,尚好的青春都是你…好想好想再跟你聊一聊啊,3,SUMMER_END__,66418134
5142,2016,2,18,大概十几天前我明白了什么是对的时间,1,Ivonka_,104251712
5143,2016,2,18,以前不懂 不知道感情是什么样 只知道石破天惊 只知道天崩地裂 可是你给了我的细水流长 而我却把你弄丢了,2,aronfang,96757224
5144,2016,2,18,我知道孤独是自己的 我是傻子 可是我还在想你,1,aronfang,96757224
5145,2016,2,18,用可以想到的一切方法都无法取悦一个人，那只能放弃，这就是最好的取悦。,2,草木皆兵_,134939273
5146,2016,2,18,心碎是自己的 孤单也是自己的,2,草木皆兵_,134939273
5147,2016,2,17,雅雅，我真的不知道还说什么，我想和你永远在一起。很幼稚吧。但这就是我想对你说的。,4,Purple2233,60604243
5148,2016,2,17,李曼粤我在等你,1,帐号已注销,124859943
5149,2016,2,17,25岁怎么让我过成这样，尚好的青春呢,2,M猫耳朵M,88532251
5150,2016,2,17,尚好的青春都是你 ,1,i慢车旅行,115429702
5151,2016,2,17,千万记得天涯有人在等你，路程再多遥远不要不会来，不去想不去计量你的心有多明白，前往幸福的路有多少阻碍。 ,3,万万万万大小姐姐,114875517
5152,2016,2,17,唐艺珊，谢谢你。,2,死亡时光,78456159
5153,2016,2,17,好想念大学生活,2,--面具人,92170866
5154,2016,2,16,记得天涯有人在等待。,1,mystrings,113814492
5155,2016,2,16,你十八岁的时候，我送了一张明信片给你，上面写了  尚好的青春都是你，真的，尚好的青春，遇见了你,1,风中的花飞了,130951703
5156,2016,2,16,王栩如我爱你，我等你回来，我会给你一个家，我会一直呵护你，你快回来,1,很哈子鸡,51816876
5157,2016,2,16,[强][强][强],2,Sssssssssssong,98469064
5158,2016,2,16,千万记得天涯深处有人在等待,2,我有寂寞和美酒,65539479
5159,2016,2,16,搭地搭地一直都在～不哭[吐舌],3,搭地搭地,50495567
5160,2016,2,15,好！！谢谢你的鼓励！,2,maybellauder,100963341
5161,2016,2,15,遗失的青春终究回不去 千万记得天涯有人在想你,2,嗨_唐小米,41475208
5162,2016,2,15,王栩如我爱你，我等你回来，我会给你一个家，我会一直爱你，你快回来,1,很哈子鸡,51816876
5163,2016,2,15,分手一年了，其实我一直都把你放在心上，有时候想你就偷偷看下你的朋友圈或者微博，猜猜你有没有男友。你要分手不怪你，只是异地恋真的好难，你身体不舒服我只能抽根烟跟你讲讲笑话，期待着放假。听着这首歌想起分手那天晚上，在阳台留着泪抽了一晚上的烟。不过现在我快要回去找她了，我知道她在等我,10,cruise_23897,106102552
5164,2016,2,15,就算真在对的时间遇见对的你，遗失的青春怎能回的去,2,毛驴想飞,96334633
5165,2016,2,15,王栩如我爱你，我等你回来， 我会一直爱你，我会给你个家，我会给你最坚固的爱，你快回来吧,1,很哈子鸡,51816876
5166,2016,2,15,就算你不会懂也不会可惜,2,老安东问题大啊,93188162
5167,2016,2,15,[大笑],2,lyc铖,97054949
5168,2016,2,15,有一天我们在北京相遇你请我吃北京烤鸭，问我一句，过得还好吗,5,留在撒哈拉的灵魂,84403431
5169,2016,2,15,我成功啦~你也加油啊,1,maybellauder,100963341
5170,2016,2,15,千万记得天涯有人在等你。突然想给所有美好着，等待着的好姑娘一个拥抱。也给自己一个拥抱。,3,满天星在发光,107557036
5171,2016,2,15,[爱心],1,甜一分苦九分ya,50669579
5172,2016,2,15,路程再多遥远不要不回来,2,studyhxz,105491715
5173,2016,2,15,失眠,1,Stef-木魚,70036533
5174,2016,2,15,浓浓的青春  即使现见没有当初的心动,3,Aleta-17,105817185
5175,2016,2,15,听哭了，莫拉朱旺。,4,臭地臭地,50522711
5176,2016,2,15,都是你,3,我可以喂你耳屎,11195667
5177,2016,2,14,王栩如我爱你，我等你回来,2,很哈子鸡,51816876
5178,2016,2,14,你等我说出那句话等了三年，同样我等你三年，也许当年太犹豫了，不过我现在已经有了答案。,4,繁星如水,75427938
5179,2016,2,14,@马有角_ ,1,Unicorn_7,48034535
5180,2016,2,14,王栩如我爱你，我等你回来,0,很哈子鸡,51816876
5181,2016,2,14,在动车站冻成狗 被妖风吹成面瘫 祝大家节日快乐哦～,1,磨人的小裙子,102489383
5182,2016,2,14,在动车站简直冻成狗 被妖风吹成面瘫。,0,磨人的小裙子,102489383
5183,2016,2,14,Best   Days  Of  My  Youth,1,Casscherrs,114773648
5184,2016,2,14,听见恨晚,4,大月先生_,78525433
5185,2016,2,14,千万记得天涯有人在等你。,2,Fleurs-de-lis,113804637
5186,2016,2,14,six month,1,嘟泡泡,45741873
5187,2016,2,14,能不能不再拿着手机等那个傻瓜，等来的却是问另一个女孩儿的消息！能不能不再担心那傻瓜的生活，能不能把心喂了狗！[哀伤][哀伤][哀伤],2,数学必修2,33031118
5188,2016,2,14,马上要毕业，要和男朋友异地了，听着这个歌，眼泪汪汪和他分享这段歌词。:千万记得天涯有人在等你风再急再狂我也不放弃路程在多遥远也不要不回来。他说，以后不管多远，我都会找到你，把你接回家。         真的希望可以一直走到最后[爱心],151,阿忘阿忘,81886781
5189,2016,2,14,听第一句，忧忧、厌厌就控制了情绪。哎,1,奋斗就对了,2140873
5190,2016,2,13,王栩如我爱你，我等你回来。,1,很哈子鸡,51816876
5191,2016,2,13,唉，你离开这么多年了不再联系 每年只敢在过年零点给你发一条祝福，看似群发，其实我只专门给你发了祝福…新年快乐,2,Gnauhs,16897530
5192,2016,2,13,千万要记得,1,古丽娜喵,102008930
5193,2016,2,13,再见,0,toexxxxxxx,99649446
5194,2016,2,13,雄厚的鲸吞都犀利[大哭],1,zzMYUzz,68951059
5195,2016,2,13,尚好的青春都犀利[大哭],1,花子花,76397776
5196,2016,2,13,嗯这就是我心里的异地恋之歌 记得天涯有人在等你,2,斑斑班班马,129388120
5197,2016,2,13,这是我第一次表白的歌给他的，回忆太多，回头太难了，现在我们也没能在一起了，听着这首歌还是想起Ta。祝Ta安好，厦门骑单车🚲的时光是我最浪漫的，那天视频你，我们哭着着，哭的视频以为打了马赛克，我说我们还能回去吗？你说不能啦，可我还是好爱你。 我希望你过得好。卷。,3,章鱼保罗的我,121418879
5198,2016,2,13,不想谈恋爱了,1,羡羡的兔叽i,64270401
5199,2016,2,13,上好的青春都是你,1,allright大海无垠,119057098
5200,2016,2,13,如果止于机场，那一切是美好的，但我却生生释放出贪婪破坏了一切。两年是我的所有。,3,我真的是浪浪呀,102361228
5201,2016,2,12,回想2004年左右听燕姿的老歌的时候，我正经历了爱情，却联想到女朋友如果能像燕姿的歌里那么痴情，那就幸福了！但并没有！[哀伤]如今，听着燕姿的新歌，歌声一如既往的痴情，我会直接联想到自己的老婆，她是那么的深情爱着我[大笑]所以我想告诉孙燕姿，我已找到了自己的燕姿[可爱],52,Chigga_yuan,78497725
5202,2016,2,12,[色],1,hhm0506,33460856
5203,2016,2,12,石沉大海，听起来像“是真的还爱啊”     [皱眉][皱眉][皱眉][皱眉]今天分手了,2,算个甚,54930347
5204,2016,2,12,熊后诶倾村龙犀利,1,放学一起回家叭,87155035
5205,2016,2,12,就算石沉大海[流泪][流泪],1,放学一起回家叭,87155035
5206,2016,2,12,尚好的青春遇见你 ,1,莉莉申,35551194
5207,2016,2,12,是不是因为天涯有人在等待，所以我也能勇敢的追逐你，趁尚好的青春还在。,2,Hyman_L,96389166
5208,2016,2,12,尚好的青春都是你,1,yunkk_,101384556
5209,2016,2,12,没人可回忆的青春，找不回来,1,青青果果,56849047
5210,2016,2,12,[哀伤],0,Stef-木魚,70036533
5211,2016,2,11,才发现第一句是闽南语后知后觉,2,帝王猫啊,84726293
5212,2016,2,11,情歌评论都成情感在线[大哭],1,段野,66035826
5213,2016,2,11,嗯嗯 之前听天黑黑 那句未落雨的读音听了好久听不出来[流泪][流泪],2,無無無芝心,53788700
5214,2016,2,11,[爱心],0,cats1cats,18265795
5215,2016,2,11,燕姿唱“就算真能在对的时间遇见对的你，遗失的青春怎能回得去”，我却想不起任何人的名字。翻阅旧照片才发现自己小女子的情绪和面貌就留在了学生时代，闪闪发光的眼神藏在电脑里再无人问津。我想要去弹一段由克里里，思来想去，大过年又跑回公司加班了。,4,小娇羞爱人鱼线,61454475
5216,2016,2,11,燕姿唱“就算真能在对的时间遇见对的你，遗失的青春怎能回得去”，我却想不起任何人的名字。翻阅旧照片才发现自己小女子的情绪和面貌就留在了学生时代，闪闪发光的眼神藏在电脑里再无人问津。我想要去弹一段由克里里，思来想去，大过年又跑回公司加班了。,1,小娇羞爱人鱼线,61454475
5217,2016,2,11,只有我是为了石陈大海来的么,3,Mr盔,101556512
5218,2016,2,11,闽南语,1,于荒,106889074
5219,2016,2,11,尚好的青春都洗涤[大哭],4,Divano-,47220729
5220,2016,2,11,只有我在笑那句 尚好的青春都是你的读音吗。。,1,無無無芝心,53788700
5221,2016,2,11,年纪大了听这首歌越来越有感觉,2,Yukihepburn,95980359
5222,2016,2,11,唉……不合适的就算强行在一起也很难走完一辈子，再深的感情又如何,2,joyhoho,45695636
5223,2016,2,10,网易云音乐每一首孙燕姿的歌都是一个故事,4,克卜勒世界巡回演唱会,83076889
5224,2016,2,10,哭了,1,甘露寺还俗弟子,132075509
5225,2016,2,10,好多想说的始终张不开口。,2,牟牟Y,91477131
5226,2016,2,9,希望我尚好的青春都是你 一直是你。,2,-然小丸,66718133
5227,2016,2,9,[爱心],1,一口一个小喷菇,29649576
5228,2016,2,9,早。,1,SUYANG26,15824508
5229,2016,2,9,我也是 不过分手后她就分享了孙燕姿的任性,2,theSen,44203147
5230,2016,2,9,有遗憾的故事才会记得清楚，所以也感谢遗憾～,2,小心浪Sina,132161285
5231,2016,2,9,不去多想,1,陈菲斯突,45402949
5232,2016,2,8,傻郭衍！全世界只有你一个人不懂！[哀伤][哀伤][哀伤],1,数学必修2,33031118
5233,2016,2,8,躺沙发，过大年……,1,BT贤,42929739
5234,2016,2,8,最近一直听这首。,1,郭zuozuo,55825258
5235,2016,2,8,"真遗憾，在我最好的时候，我最爱的人却不在我身边。
",1,严肃的吴二梦,33986955
5236,2016,2,8,别难过[亲亲]一切回过去,3,微凉vv丶,103468884
5237,2016,2,8,以前我看一篇文章说，每一个人都要保护好你的“月亮”，也就是你的需求，要你要的，不要你不想要的。我渐渐学会保护自己，只是看起来是。,2,银二两,12289360
5238,2016,2,8,这个世界上 有些人有多冷漠 有些人 就有多温暖 希望你总是遇到 那些温暖对你的人[憨笑],0,抱歉不如抱我,117361246
5239,2016,2,8,是的,0,Stef-木魚,70036533
5240,2016,2,8,mark一下 尚好的青春,1,一只懒蛋_,77075160
5241,2016,2,8,热评的人都去写言情吧，绝对碾压郭小四[奸笑],2,翊颗苹果,98315435
5242,2016,2,8,2016真的到了 今年高考年 希望去自己想去的广外学想学的西语 人生转折呢！,2,角落方块,55836410
5243,2016,2,7,今晚除了看无聊的春晚还能做些什么，我尚好的青春。,1,孙微凉,73687959
5244,2016,2,7,尚好的青春都是你,1,大胖鹅儿,73953668
5245,2016,2,7,天涯有人在等你,1,是我阿v,126489050
5246,2016,2,7,千万记得天涯有人在等你,1,尚好的青春2020,77425010
5247,2016,2,7,前往幸福的路有多少阻碍？该如何始终该如何，懒得去管，顺其自然。,1,不睡懒觉了,105394922
5248,2016,2,7,从脚踝到心脏的伤心-,1,浪味仙莉,45478025
5249,2016,2,7,从脚踝到心脏的伤心,1,浪味仙莉,45478025
5250,2016,2,6,送你～,1,Zippo张,59818543
5251,2016,2,6,高三时我们期待着克卜勒  这首尚好的青春是我们两个都爱的 互相分享心情 向别人推荐孙燕姿新歌 想起高中就感动 尚好的青春都是你 ,1,由唱到听,117439976
5252,2016,2,6,如果你非要拒绝我，请不要那么绝对。因为你的一句“我没有那么喜欢你”，我都可以解读为“我有一点喜欢你。,5,古怪少女meng,128647994
5253,2016,2,6,朋友你好，你好朋友,1,Persecutory_Delusions,101374129
5254,2016,2,6,同，今天回家的路上耳机里随机出了这句，整天的脑海里都是尚好的青春[皱眉],1,桌上那杯旧咖啡,41242210
5255,2016,2,6,苦笑不得，晚安，[猪]。,1,Roger格调,17617849
5256,2016,2,6,第一句就哭了,0,olly的牙缝,34885501
5257,2016,2,6,尚好的青春都是你[流泪][流泪][流泪],0,olly的牙缝,34885501
5258,2016,2,6,突然脑子里都是这首歌，尚好的青春都是你,1,Persecutory_Delusions,101374129
5259,2016,2,6,@隔壁老江 ,1,帐号已注销,55160961
5260,2016,2,6,静静的听很感动,1,一只小熊猫Y,130622618
5261,2016,2,6,。。听这首歌时我和你相隔千里，你愿意再等我半年么？你知道我一直爱着你两年了么,2,银河系系花f,131215709
5262,2016,2,6,Aqui te amo [亲亲],2,楚楚楚楚楚萌,124848015
5263,2016,2,6,尚好的青春里，都是你。我爱你！[亲亲]@楚楚楚楚楚萌 ,4,尹尹尹尹尹哲,56040857
5264,2016,2,5,是,1,另一个林一峰,102043301
5265,2016,2,5,[憨笑],1,Kangteuki,82107066
5266,2016,2,5,看MV有泪点,1,随便一个称呼而已了,111843455
5267,2016,2,5,赞MV的好音乐,0,随便一个称呼而已了,111843455
5268,2016,2,5,爱这首歌的MV[牵手],1,泰勒斯的网易云,122329668
5269,2016,2,5,网易评论有毒[流泪]，半夜打开看就完全睡不着了。,2,THEOD,89411667
5270,2016,2,5,尚好的青春这句是用闽南语唱的吗,3,拾间_,55067553
5271,2016,2,5,最好的时光，hi,1,力的宏,34361818
5272,2016,2,5,嗯嗯，谢谢你鼓励！你也加油！！！,0,maybellauder,100963341
5273,2016,2,5,唉，天哪，我是后知后觉那种，对感情超迟钝的，可是可害怕被拒了，唉,0,maybellauder,100963341
5274,2016,2,5,唉，可是他是以前跟我表白啊，前年一次去年一次，但是我不知道现在他对我啥感觉，哭。。,0,maybellauder,100963341
5275,2016,2,5,有闽南人吗？尚好的青春就是最好的青春吧😄,1,系系系系子,42003861
5276,2016,2,5,我没有故事，只有酒，有没与人想和我一起喝,1,11月10日,116990748
5277,2016,2,5,尚好的青春[强],2,好吧我有点彪,62536531
5278,2016,2,5,[星星],1,Maxy-,94355386
5279,2016,2,4,下次见面会是什么时候,0,孙燕姿的锁骨,17714009
5280,2016,2,4,“你怎么不喝酒了，有心事吗？”,1,请声張,80109346
5281,2016,2,4,打卡,0,第265天的呆滞,68308200
5282,2016,2,4,尚好的青春，都是你。,1,李皮皮在梦游了,62544532
5283,2016,2,4,尚好的青春都是你，没有片刻不想你，如今想念的那个人也已依偎在了别人的怀抱，也会和别人甜言蜜语，互道晚安。再也找不到一个可以打扰的理由了，无奈有些喜欢，落地便成遗憾,2,萌韬韬,109551196
5284,2016,2,4,西红柿和番茄                                         马铃薯和土豆                                           我喜欢的人和你,1,初见9,101818340
5285,2016,2,4,我一定是傻了。尚好的青春都是你。,2,王二不,90387592
5286,2016,2,4,演唱会的时候，感觉是燕姿和爱她的人的诠释。,0,zhengke_,129442832
5287,2016,2,4,你会不会有时候十分想念一个人，却不能联系。常常想念的嗜骨铭心，也只能告诉自己忍忍就好。,2,黥公子,50979497
5288,2016,2,4,看了看评论  你说我一个单身狗怎么也这么爱这首歌[狗],4,年少不识少年,84390771
5289,2016,2,4,尚好的青春都是你用闽南语唱的 我居然一直以为是胸口仅存的洗涤[大哭],3,又见炊烟袅,121114958
5290,2016,2,4,再遥远都跟随你,0,又见炊烟袅,121114958
5291,2016,2,4,[可爱],1,许多年以后我依然是我,83271175
5292,2016,2,4,演唱会的时候 这首歌真的是最戳的 ...,2,莱莱莱莱莱,51531590
5293,2016,2,4,不知道。。直觉？他之前跟我表白过，我那时候还没感觉。。。唉。。。[大哭],0,maybellauder,100963341
5294,2016,2,4,你这个头像😲我在贴吧看见过…你不会就是那个故事的主人公吧,1,Shoulders-,35517956
5295,2016,2,4,尚好的青春都是你 没有片刻不想你,1,grace1581739,104564603
5296,2016,2,4,[亲亲],1,澜本姿语,76707783
5297,2016,2,4,坐Uber时第一次听见这首歌，怎么那么伤感啊，太消极了不好 小伙子,1,亲爱的苏_,11022994
5298,2016,2,4,千万记得天涯有人在等你[爱心],4,Evelyn_YSY,105100770
5299,2016,2,4,还没！我搬家了在外地，初三火车回去表！你也加油啊，我们俩情况不一样，反正慎重一些。。,0,maybellauder,100963341
5300,2016,2,4,尚好的青春都是你，没有片刻不想你。,0,Evelyn_YSY,105100770
5301,2016,2,3,青春飞逝就再找不回来。谁不想一辈子只爱一个人，尚好的青春全是他。,1,诗远并狗,66507501
5302,2016,2,3,歌词写的真好,3,yuyuerz,81537970
5303,2016,2,3,2013.11.19 你我相识 2013.12.5 开始磨合2013.12.24我们过的第一个平安夜 2014.2.4我陪你过的第一个生日 2014.4.23我们选择转身离去 2015.2.27你结婚 然后我问自己记住那么多日期有什么用…现在是2016年2月3日 你都已经有了孩子 而我还是记得每一个对于我来说值得珍藏的每一个日期 何必呢,214,93要做个好人,1818704
5304,2016,2,3,特别是哪个MV，白首偕老，感动感动,1,杍山,120285666
5305,2016,2,3,第一次听就被吸引了，淡淡的感动，就算石沉大海～大海～～,0,杍山,120285666
5306,2016,2,3,❤,1,GYuRan,87768038
5307,2016,2,3,风 再疾再狂我也不放弃,1,帐号已注销,54365284
5308,2016,2,3,遗失的青春怎能回得去,2,白菜酱不粘糖,118426294
5309,2016,2,3,固执算不算任性的要求😶,1,大脸魏,59958630
5310,2016,2,3,如果当初可以。只想一辈子爱一个人。 不想认识余下那么多的。对你的爱下成雨也不愿淋湿你。,4,姚板眼er,46623527
5311,2016,2,3,[亲亲],0,oliveryyyy,85625555
5312,2016,2,3,尚好的青春,1,Taycat,110199453
5313,2016,2,3,好伤感的歌,1,iu未公开男友,99782383
5314,2016,2,3,[爱心],1,Hiyi22,99790878
5315,2016,2,3,你站那别动 我一定会找到你 你等等我,2,欲穿的望眼,89936098
5316,2016,2,3,那时候觉得，仙女和凡人。谈恋爱会触犯天条吧。。,0,请问你是可达鸭吗_,79384274
5317,2016,2,3,尚好的青春都是你，愿我到达你还在。,0,Taycat,110199453
5318,2016,2,2,喜欢的男生也喜欢燕姿 突然觉得很巧 像命运让我们在一起一样 可惜他不这么觉得,1,妞小鸥,36901231
5319,2016,2,2,"我也开始听女歌手的歌了～～
",2,ShinkingDream,78415495
5320,2016,2,2,是时候   克卜勒这两张专辑每首歌都喜欢,1,枫过无声jay,82051412
5321,2016,2,2,一条评论一个故事。有这样的歌真好。,1,帐号已注销,7934215
5322,2016,2,2,可能很多女生喜欢孙燕姿声音里的倔强吧,4,欧阳小小小小小小小小小小小小小,18879459
5323,2016,2,2,千万记得天涯有人在等你,3,我叫蔚舟,92935651
5324,2016,2,2,如果能站在对的时间遇见对的你……,2,苏纬同學,7543982
5325,2016,2,2,认识你的第四首，最心痛的一首,1,Abel_C,95963646
5326,2016,2,2,石沉大海总听成是真的爱哎,1,记忆中的路,64659436
5327,2016,2,2,表白前听这个哈哈哈~[爱心],1,maybellauder,100963341
5328,2016,2,2,无所谓的流逝着，明天才是最紧要的怀念不是真的,1,白的心,61014673
5329,2016,2,2,"深夜容易被思念和绝望占据灵魂拉扯内心。
",2,iamcarrol_lll,29726453
5330,2016,2,2,深夜容易被思念拉扯，灵魂内的绝望占据了清醒的身体。好想你.....,1,iamcarrol_lll,29726453
5331,2016,2,2,"深夜太容易被思念和绝望占据灵魂。
",1,iamcarrol_lll,29726453
5332,2016,2,1,在我们年少的时光里，最自以为是的固执也许就是觉得掏心掏肺的喜欢一个不爱自己的人，终有一天会感动他。👈你明知道感动不是爱，却还是顽强得可怕。只是在后来更久远的岁月里，你才在眼泪里真正明白青春最大的错觉莫过于如此。可已经来不及了，你有过痛彻心扉的遗憾，也有了一个想忘却忘不了的人。,2,玉梓茗,44747905
5333,2016,2,1,我其实还很喜欢你，被拒绝这么多次我还是很喜欢你。,3,君有匪,121068039
5334,2016,2,1,我去听你演唱会 一定哭成[狗],1,Jess猫猫,2984305
5335,2016,2,1,尚好的青春都是你，怎么能片刻，不想你。,1,猫与低苦艾,125068705
5336,2016,2,1,听着忧伤的调子突然好疲惫。。,1,帐号已注销,51403137
5337,2016,2,1,如果没有孙燕姿，这个世界该有多寂寞,1,Macwinnie,3302542
5338,2016,2,1,就算给你的爱石沉大海,1,三月破晓,45879452
5339,2016,2,1,尚好的青春都是你,1,youuah,125570747
5340,2016,2,1,整个克卜勒都好听QAQ,1,花樣漾,52781631
