index,year,month,day,content,likecount,nickname,user_id2677,2019,10,19,不要再说抱歉了 很遗憾不能成为彼此心中的对方却付出了真心 如果说喜欢这份心情无法扼杀掉 我也会一个人藏在心底 虽然离开以后才可以变得更好的自己 但这就是人生吧 你不是陪伴我到最后的人 我也不想把你永远缅怀 相忘于此吧 不舍也要舍得 尚好的青春 只存在过去 无需等待 要接受岁月带来的沉稳与孤独,1,敢敢不再,1903363447
2678,2019,10,19,高考完 我青春里的等待 一定会结束吧,1,二芽耶耶耶,1489560015
2679,2019,10,19,体育考试是有分数的吗,0,二芽耶耶耶,1489560015
2680,2019,10,19,我后悔了，并没有，下雨好冷,0,樟茶鸭喇喇,428115081
2681,2019,10,19,说实话，我想再早一点遇见你，如果可以，我希望能早一点照顾好你，异地恋不是我所愿，对不起。,0,名字不特别怕你记不住,514053145
2682,2019,10,19,歌词很美好，现实很残酷,0,LY星言,1798213358
2683,2019,10,19,456天 本想狠下心再也不想看到关于任何你的消息  听到这些歌  我还是忍不住会想你 以后你一定要要好好的阿,0,万志坚995,347485781
2684,2019,10,19,呜呜呜呜呜呜，太喜欢燕姿了,0,是兔牙守护者呀,309297073
2685,2019,10,19,就算给你的爱，石沉大海，我依然是那个爱你的我。她一定也在未来的路上吧，不要放弃啊。一定，一定。,0,窨紫,304317764
2686,2019,10,19,尚好的青春都是孙燕姿,0,SANJIU9,281870167
2687,2019,10,19,可惜不是你,0,-官官雎鸠-,1453206445
2688,2019,10,18,"高中三年了
已经高三的我们
过完明年的六月
我们或许真的没有那种高中恋爱的甜蜜和羞涩了。
努力啊 体育考试。
文科生的我。
我其实很清楚我们的终点的",1,丧的时候不像话了,1402744846
2689,2019,10,18,毕业聚会当着全班的人向你告白。不想让自己后悔还有也让我知道努力了不一定会有结果。,0,喵星人丶乛,1569538038
2690,2019,10,18,分手快五个月了呢， 好像你也渐渐变得模糊，变得陌生， 世界这么大， 我们还会再遇见吗？ 遇见时我们还是熟悉着，还是已经变得陌生？,0,夏依依离开,1413164224
2691,2019,10,18,那个时候的我有好多梦想啊,0,最喜欢杨高高了,1606484898
2692,2019,10,18,我爱他 可是他错过我了 我的青春是什么 我也不知道 只记得那天傍晚放学时 你从我的身边经过 我哼起这首歌 你愣住了,2,最喜欢杨高高了,1606484898
2693,2019,10,18,那你还爱他吗,0,最喜欢杨高高了,1606484898
2694,2019,10,18,最难过的大概就是你以为会陪你很久很久的人 非常轻易的离开了 而且无论你怎么求他 他都不肯回来了,0,最喜欢杨高高了,1606484898
2695,2019,10,18,大概是没有人在等待的吧,1,Lavenda_J,294325626
2696,2019,10,18,希望，你永远幸福,1,女兆羊习习51,52095011
2697,2019,10,18,还有一个月就要见面了,1,六六大顺-3,430267554
2698,2019,10,17,不要叫燕姿姿妈！---来自大叔的狂怒,2,its燃,1411252243
2699,2019,10,17,为什么偏偏在这时候喜欢上你,0,晨半仙儿,393085972
2700,2019,10,17,我也有个六年,0,霸道本道,549699455
2701,2019,10,17,突然想跟着唱，结果始终第一句都唱不准哈哈哈，,1,不与zs,122063625
2702,2019,10,17,那是我青春记忆,0,Gu朗,84778392
2703,2019,10,17,没法不想他，没法离开他，听不得他好，更听不得他不好,0,霸道本道,549699455
2704,2019,10,17,尚好的青春都是你，我的疯子。,0,Mineee,1654313083
2705,2019,10,17,原来太高兴真的会哭,0,Rachel-ki,281395192
2706,2019,10,17,"TO肖战：
尚好的青春遇见你，认识你，喜欢你",0,甜战盐战都可以啊,505007435
2707,2019,10,17,未来的她一定要喜欢孙燕姿,0,-Charlie-qhx,31967477
2708,2019,10,16,山东-长春，1481公里，绕着操场走一圈是400米，走过3545个操场就能见到你[狗],1,晴天娃娃130903,412552491
2709,2019,10,16,千万记得有人在等你,0,彩虹金刚刚刚刚,1401962569
2710,2019,10,16,如果她能听懂这首歌，也不会轻易放弃的吧…,0,彩虹金刚刚刚刚,1401962569
2711,2019,10,16,记成meet了吧,0,呵呵哒名字多,304577661
2712,2019,10,16,我好想他。,0,Gu朗,84778392
2713,2019,10,16,可是他没有和我在一起。我连做梦都是他离开我的样子。,1,Gu朗,84778392
2714,2019,10,16,如果和我在一起的人不是那个男孩，我想，我要成为女富豪 我要成为这个行业顶尖人物 我要赚好多钱。可是一想到他，我就突然觉得 怎么样都好吧 只要他在我身边就好 我突然就只想窝在沙发上和他看一场电影。我好想他。尚好的青春 都是他。,1,Gu朗,84778392
2715,2019,10,16,太温柔了,0,车不软T,538158358
2716,2019,10,16,就算给你的爱石沉大海，也感谢你来过我的生命。,2,复古的哈密瓜,263705755
2717,2019,10,16,千万记得天涯有人在等你 ,0,zo啾啾,402430152
2718,2019,10,16,你尚安，青春便尚在,0,好黎婧,120926893
2719,2019,10,16,我们漳州是说shang hou，厦门泉州说Xiong hou 其实就是口音不一样而已，意思都一样，也都懂就行了，没必要去纠结这些,0,娈娈爱哭,1504114395
2720,2019,10,16,“千万记得天涯有人在等你，风再疾再狂我也不放弃。”,0,宇治東耳,351995985
2721,2019,10,15,这首歌，太美好了❤️,2,梦是林夕阿,287555625
2722,2019,10,15,千萬記得天涯有人在等你,1,stef虎牙,86952410
2723,2019,10,15,花开两朵，天各一方,0,潯魚兒,277516135
2724,2019,10,15,黄老板 我特别特别喜欢你,0,小胡小胡甜过泡芙,472367543
2725,2019,10,15,突然挺熟悉的感觉，我喜欢，又多了一首歌,0,静待CCC,476407368
2726,2019,10,15,职场动物,0,你是不是超神的涂山苏苏,535202648
2727,2019,10,15,小孩雪莉，晚安。下辈子只做个崔真理吧,4,今天晚上下雨了吗,485950575
2728,2019,10,15,尚好的青春都是你 永远祝福你 要永远幸福,0,Vnoqwhc,325429179
2729,2019,10,15,感情丰富是好事，至少不是麻木的人,0,小伍小五小舞,298595929
2730,2019,10,15,听歌名就觉得一切都来得及 来得及,0,pharaohup,582821873
2731,2019,10,15,镇原到合肥，1310公里，3275圈操场，但是距离在真爱面前不堪一击[鬼脸],0,非文就学理,498393662
2732,2019,10,15,尚好的青春都是你，你也一定要过得幸福,0,昔妤v,136440952
2733,2019,10,15,这首歌对我来说有一个故事，但已经是一个不想再提起的故事了。,0,WaiYee_Cheung0222,247961282
2734,2019,10,15,"我的青春呀，我喜欢了十几年的男生今天结婚啦。好多人给我发消息，你一定要幸福，“就算给你的爱石沉大海 青春飞逝就再找不回来”
你一定要幸福呀 我的青春也终于有了托付",5,我的少女骄纵且贪婪赤诚又勇敢,276950889
2735,2019,10,15,为什么吉他一直在右耳，我耳朵好不舒服,0,空位__,294579277
2736,2019,10,15,我的青春呀 魏晨求婚成功啦 要一直一直幸福下去 尚好的青春 都是你♥️,8,我的小熊不能给你,540281020
2737,2019,10,15,想到这首歌  所以来听一下,0,T孤岛的鲸-,131891827
2738,2019,10,15,好听呀呀呀,1,愿君依旧笑,559237310
2739,2019,10,15,到最后到底会是小幸运还是可惜不是你呢,1,-官官雎鸠-,1453206445
2740,2019,10,14,静香胖虎爱你,1,_pipipi,380207625
2741,2019,10,14,爱你静香,1,_pipipi,380207625
2742,2019,10,14,可是静香是大雄的,1,_pipipi,380207625
2743,2019,10,14,胖虎还爱静香,1,_pipipi,380207625
2744,2019,10,14,刘兰👴我还爱你,1,_pipipi,380207625
2745,2019,10,14,我爱你 希望以后有机会还能在一次喜欢你,0,方甄陶,69642140
2746,2019,10,14,错过是为了下一次相遇 要开心啊,0,bigotry160,1950675505
2747,2019,10,14,今天出了一个新鲜生命去世的新闻 就听到这个,2,CARRIE____ON,284699736
2748,2019,10,14,"快七年啦~……我从来都不后悔
我的青春里都是你，即使最终也无法在你的青春里留下淡淡的一笔；即使从来都没有感受过恋爱的滋味，我也不会放弃更不会离去……祝你一直开心啦，在自己想要的生活中去做想做的事情，找到幸福↖(^ω^)↗无论另一半是不是我（我猜我不会被发现哈哈哈[鬼脸]）",2,Reverier-Xu,544989612
2749,2019,10,14,"没有陪伴的路，也要往前走啊，才能看到最美丽的夕阳！
我怎么可以辜负自己的生命呢？",1,cute米,470076323
2750,2019,10,14,石沉大海,3,愿君依旧笑,559237310
2751,2019,10,14,"相比圆满的结局
无终的青春更吸引人不是吗？",1,梦系旅人x,543724436
2752,2019,10,14,骗你呢,0,玻璃庭院,1698872465
2753,2019,10,14,就算给你的爱 是真的还爱,0,求个善果,410549195
2754,2019,10,14,这个音频是不是有点问题啊…为啥我听中间卡了好几次,1,hitIergao,80752734
2755,2019,10,14,没有片刻不想你,1,全村最美sy,1648835776
2756,2019,10,13,这辈子什么时候才过完,0,啊清清清清清清,292284182
2757,2019,10,13,我也是,0,哈喽shiyu,283983923
2758,2019,10,13,我喜欢你xz,1,不辞冰雪为卿融_,437104774
2759,2019,10,12,何凯，我会继续喜欢你，只不过我再也不会找你了,2,求你别听林宥嘉,441833046
2760,2019,10,12,fh 我想你了,0,余醉170703,532472505
2761,2019,10,12,尚好的青春都是你。千万记得天涯有人在等你。[爱心]14年的某一天,1,sunflower西西,1582073571
2762,2019,10,12,可真好听 啊,1,Nubies,494286596
2763,2019,10,12,被公司优化了，给了补偿，虽然还算满意，可是要跳出自己的舒适区了,2,只是丶活在梦里,74200585
2764,2019,10,12,可是她没有删掉前任的所有东西,0,VLOKI,136850186
2765,2019,10,12,"嘿 你要走了 别忘记那个酒吧 别忘记胡辣汤别忘记我们走过的路 千万记得 天涯真的有人在等待 千万记得 有个人无脑在乎你 千万记得 我们说好的下次见面",3,早告别青春活成了别人,557704897
2766,2019,10,11,这歌我听出了周杰伦的味道[大哭],2,麻木偏可换长久,282612360
2767,2019,10,11,好好加油 我会好好加油  眼下的日子难熬 我也会充满信心的努力,1,二成成成,1289372764
2768,2019,10,11,给你发我好想你又撤回是什么心理，既想让你知道又不想让你知道。,2,半吊子吉他选手,614879409
2769,2019,10,11,石陈大海[哀伤],1,Rainbow-o-,387330192
2770,2019,10,11,千万记得天涯有人在等你,4,我鍾憶妳呀,418111202
2771,2019,10,11,I'll try anything once.,1,LuckyRabbi-t,1911715660
2772,2019,10,11,想想就好了,0,DDVP_-,340687591
2773,2019,10,11,@冯大朋友,0,石小盆友,337549780
2774,2019,10,10,我听不了呜呜,0,Musiciasian,45924875
2775,2019,10,10,哈哈哈钻纠的，握手,0,melody-----,44616783
2776,2019,10,10,加油！,0,ta是怪诞与自我,293134694
2777,2019,10,10,龙港？,0,山中空梦久,124156658
2778,2019,10,10,Today is another day of special love for you-HL,0,一觉睡到小时候呐,427394962
2779,2019,10,10,都过去了,0,姚先森吖,439076687
2780,2019,10,10,同城！！！！！,0,战哥的佩佩,1396781438
2781,2019,10,9,现在十月了 记得刚和你在一起还是高三开学的这个时候  现在我在实习了 这个天气忽然就想到了和你在刚在一起的时候   这首歌也是你喜欢的  但是我们分手了啊 在新学校过的好一点  我挺好的 当然  你也不担心我好不好 ,2,今天泥吃饭了吗,259976080
2782,2019,10,9,第一天上班 就要写文书 emmm俺想睡觉,0,粥南男,439553868
2783,2019,10,9,默默的喜欢你快六年了😊,1,L李锐杰,1891095343
2784,2019,10,9,我不想有期待了，我不会刻意遇见了,2,伤心猪大肠wj,1834681991
2785,2019,10,9,我的青春都是你啊，我的眼睛也曾在发光。,0,迷人的嘁,507669230
2786,2019,10,9,没故事，但是孙燕姿的歌真的很好听,2,燚月生,423594084
2787,2019,10,9,千万记得天涯有人在等待，路程再多遥远不要不回来，,1,巧了个巧哎,1646246498
2788,2019,10,9,没关系，你去飞,2,木子田呐,370351022
2789,2019,10,9,"尚好的青春都是你。
我的青春都是尚皓。",0,等尚先生,1957989988
2790,2019,10,9,@Musiciasian 孙燕姿的歌这么煽情的呀[亲亲],0,depths_,126226752
2791,2019,10,8,你开心就好,0,沈卿野,529905133
2792,2019,10,8,就这样,0,沈卿野,529905133
2793,2019,10,8,"分手后还要求我 像以前那样热情地对待你
但我那样只是对恋人
你 不配",1,沈卿野,529905133
2794,2019,10,8,"我想要被坚定地选择
你和他 你觉得刚刚好
那就刚刚好好喽",4,沈卿野,529905133
2795,2019,10,8,"很感谢你给过我的爱意 温暖 但都过去了
从你放弃我的那刻起
就这样吧",3,沈卿野,529905133
2796,2019,10,8,不爱我就拉倒,3,沈卿野,529905133
2797,2019,10,8,不会对你抱有期待了,2,沈卿野,529905133
2798,2019,10,8,"你不选择我
我也不会再主动了
就这样",3,沈卿野,529905133
2799,2019,10,8,"不管你还爱不爱我
我是没有被坚定地选择了
你要和他在一起就在一起吧
我没有意见",1,沈卿野,529905133
2800,2019,10,8,我會乖乖等你的。,0,瀧澤萝卜,251827506
2801,2019,10,8,5月我生日的時候 我們認識 你第一次跟我說話 現在10月份了 我第一次來找你 然後我們在一起了 我今年27 你17 嗯 我比你大十歲 你在新疆 我在四川 相隔3000多km 還要等兩年你才高中畢業 我會等你的呀 我要你的青春 都是我❤️。,4,瀧澤萝卜,251827506
2802,2019,10,8,我们真的会过去，你口中的那个人终会变成别人，谢谢有你的高中，如果可以我希望我们一开始就不要认识…,1,我会找到的最好的我和最好的他,1482961140
2803,2019,10,8,"我没有看天气预报的习惯，从来都是你提醒我穿衣带伞。
这个月底，你要结婚啦，那个姑娘我没见过，但你一定会拥有自己想要的孩子的。
以后呢：要克制自己深夜不要再给你打电话，有什么事也不去招惹你了。
那天晚上第一次见你哭，唉，你这人好自私，从没想过我。。。",5,埠扶河,323477120
2804,2019,10,8,[多多大哭][多多大哭][多多大哭]好想猫老师,0,纯情宇宙,490847971
2805,2019,10,7,不知道为什么  今晚得眼泪止不住   它一点豆止不住 ,2,好好想想好好想想,302156909
2806,2019,10,7,小学快毕业的时候认识了你，不知道原因在初中你把我删了，一直到现在没有联系过。不知道现在你对我什么感觉，但是你让我牵挂了9年,1,LTJJYW,469685062
2807,2019,10,7,天哪 好羡慕 祝幸福,1,LTJJYW,469685062
2808,2019,10,7,你说的话，果然是骗我的。你不会等我，你也从来没有想过等我。,0,_-珈蓝-_,1528961795
2809,2019,10,7,看了歌词才知道第一句唱的啥,0,Tina-_-Tian,366207791
2810,2019,10,7,当原则遇到心动就破例,1,iqiqgnauh,509805794
2811,2019,10,7,当我感觉到了生命的美好之时，却已经预感到自己的时间可能所剩无几,0,一笑丶丶丶,249453619
2812,2019,10,7,一起走过了三年 最后以难堪结尾 听见这首歌的时候我忘记了憎恨 我想我们绝对把彼此捧在手心过 至少 每次路过篮球场的时候 只会想起你,0,渡------,1377035628
2813,2019,10,7,千万记得天涯有人在等待[多多大哭],2,耶鲁1805,1449316529
2814,2019,10,7,加油,0,木棉先生_,259295530
2815,2019,10,7,"千万记得天涯有人在等待
分开那么久了，忘了他吧
更好的人在等你呢",0,小小粉刺猬,509882113
2816,2019,10,7,非常抱歉，我又错过了一首好歌好多年！[哀伤][哀伤]果然我喜欢的人的女神每一首歌都值得细细品味[爱心][爱心]感谢现在没错过,1,Wx-琑,382937149
2817,2019,10,7,早安，陌生人,0,也许像星星星星,1378142210
2818,2019,10,7,会有灯火通明的那天的 你要等,2,戊寅年冬月十二,371999870
2819,2019,10,7,我太痛苦了，我真的太痛苦了，我怕我撑不住了,1,二成成成,1289372764
2820,2019,10,7,千万记得天涯有人在等你,1,knmn17,1366052575
2821,2019,10,7,回到最初那一刻好不好,2,Yu是鱼鱼呀,1315625358
2822,2019,10,7,祝好,0,一只橙子儿yo,133539554
2823,2019,10,7,"一开始，
你：不负如来不负卿
我：不负此生不负你
后面发现，
卿前有如来，我亦有此生
最后，
卿找到了如来，我在过我此生。
——《卿如来我此生》",6,卿如来我此生,1520642771
2824,2019,10,7,这歌怎么听得我就这么想哭呢,1,耒爻,81499337
2825,2019,10,7,青春你又是在谁的身边度过,2,麥嘉嘉嘉嘉怡怡怡怡,393896079
2826,2019,10,7,时间就这么一天天过去了，那些青春也过去了,0,贾大梦,35722616
2827,2019,10,6,我有一个天大的秘密，喜欢他那么多年并且没有办法放下他。,1,_YaNGCaNLi,604681661
2828,2019,10,6,十几岁喜欢的人真的会喜欢好久哦,6,eeaian,252429122
2829,2019,10,6,我没有着急，我先去读了我书，我也去看我的电影。可我没有等到我们会窝在一起读同一本书，看同一部电影的那一天，我们就这样再也不会再见了。,3,玫瑰醉鸽,38671443
2830,2019,10,6,我好想回来,1,Melody-南,541843684
2831,2019,10,6,十八岁遇见你，大概是我最好的青春的时候吧，不知道你还有几分喜欢我，会不会像我一样，没有一刻不想你，时刻关注着你。我一直在等你，一天看你朋友圈无数次，想见到你，想听你声音，你的视频看很多遍，夜深的时候想找你，忍着这些情绪。希望你想我就回头，我已经做好了将尚好大的青春都留给你的准备了,1,-kaboom-,391211895
2832,2019,10,6,想知道哪里的体育馆信号那么好,0,啊落,47327318
2833,2019,10,6,和你一样的经历，兜兜转转我还是放不下，现在我们在一起快两年了。,1,-3-Lyn,104446087
2834,2019,10,6,我不等你谁等你。我不等你我等谁。你不等我我等你。,1,2468-_,489817318
2835,2019,10,6,有点矫情，虽然这么说会被喷[可爱],0,Vicaa,315599270
2836,2019,10,6,尚好的青春，不只是都是你呢，都也是一直淅沥啊,1,泠源_,550306391
2837,2019,10,6,为什么要那么远上大学啊,5,鲜小熊双响炮,310829205
2838,2019,10,6,石陈大海，一生所爱[爱心][爱心][爱心],2,黑白-小巷,255267731
2839,2019,10,6,演唱会这首歌也是把我唱得眼泪直流,0,晃啊晃的晃,121570058
2840,2019,10,6,以前初一时，没手机玩，没到6点多就看音乐频道，每次都会有这首歌的mv，我当时可羡慕mv里的情侣了，现在高二了，我还是很羡慕......,1,妙艺兮,1386470345
2841,2019,10,5,千万记得呀,0,Crush_初老,516869738
2842,2019,10,5,过于真实,0,楼岚素心,288771811
2843,2019,10,5,以前一点的人爱得好勇敢,0,Link-ti,593407608
2844,2019,10,5,会怕以后后悔嘛,0,意喻1711,642649209
2845,2019,10,5,就算给你的爱石沉大海,3,与歌岛年,425897200
2846,2019,10,5,谢谢你,0,土十一郎,1675173129
2847,2019,10,4,我不想浪费时间了,4,一定要去孙燕姿的演唱会,573979628
2848,2019,10,4,之前喜欢的人给我分享了这首歌，当时听没什么感觉，现在快分开的季节再听这首歌一字一句都让我心痛。,2,ILeben,572435605
2849,2019,10,4,在出租车上听到这首歌，现在西安下着雨，越来越冷了。本来我应该是在家，家里应该不冷吧，空间还是短袖上身的你们，记得想我好吗。,2,做个噩梦没什么不好的,1375757529
2850,2019,10,4,从六年级听到现在的歌，我现在高一了！或许是对感情太迟钝了吧，错过了很多很多美好的人，不过还好，我抓住了最好的现在。思念就在风里，就算你不会懂也不会可惜。,0,白蓮聖母心,1379675389
2851,2019,10,4,千万记得天涯有人在等待,2,白开水好喝奶茶不好喝,69487648
2852,2019,10,4,我会一直等你 一直,0,你是年少的欢喜sc,623861611
2853,2019,10,4,有一天她问我. 她在我心里她像什么？ 我说像月亮！她问为什么. 我说因为茫茫星空我一眼见你. 后来我反问她. 我在你心里像什么呢. 她说像星星.，原来我在你心里这么明亮！ 不！ 是多一个少一个都无所谓💔,1,babydghds,1923568848
2854,2019,10,4,我的青春好像谁也不少，又好像谁也没来过,0,帅呆的脸盆,422646615
2855,2019,10,3,车站里永远不缺不舍的眼眸,1,画图求值域,470246498
2856,2019,10,3,那天 同学在教室里放“天黑黑”，我蓦地想起他曾说过“你声音好像孙燕姿”，不禁潸然泪下。想想还是不遗憾了，给他唱过尚好的青春，他应该会晓得，他也曾是一个女孩子尚好的青春啊,2,-当是寻常,304863530
2857,2019,10,3,广西—湖南，在一起的第一个月就变成军恋啊,2,焦虑症患者3,563421397
2858,2019,10,3,没有一刻不想你,1,一粒番茄蛋,1453440193
2859,2019,10,3,吃，，,0,我聚聚最可爱,624732979
2860,2019,10,3,他把我删了，把我朋友屏蔽了，前段时间我还会去看他的朋友圈，现在我们都有了自己的生活，都会过去的,0,王大脸耶,1467547976
2861,2019,10,2,你去澳大利亚一年半了。青春是一场豪赌，我还是喜欢你。你说选择回国，因为我在国内。你怕我走远了你无能为力。我以为我可以守得住异地的各自成长，可当想到你在的明天却充满了期待，这些年我已经强大到可以自己生活，但我还是想和你在一起。,3,小阿喵的远方,469166356
2862,2019,10,2,千万记得天涯有人在等待。[多多瞌睡],2,小恶魔_Mts,1553189728
2863,2019,10,2,尚好的青春都是燕姿,2,XQ0823,489797899
2864,2019,10,2,尚好的青春都是你，转眼秋天又来了，我也立秋了，青春和你仿佛是上世纪的事儿了。,0,_八九找十,1329079335
2865,2019,10,2,这个世界什么都在变，可什么时候思念才能减少一点,0,黯黯秋风寻南浦,560053381
2866,2019,10,2,有些歌真的是拥有特定的记忆，一听就泪目,1,雎洲客,324017555
2867,2019,10,1,67373upup,1,橘猫家大德,561700466
2868,2019,10,1,千万记得天涯有人在等你,0,舆旅1998,104317238
2869,2019,10,1,因为我的青春出现了你，才称得上尚好,5,下個世紀再遇見,533452294
2870,2019,10,1,生离死别,2,玫瑰的旅行,477237174
2871,2019,10,1,哈哈哈原来如此，哇离开厦门后看见这些地名觉得好亲切哦，泉州和厦门是几乎一样的，沟通无碍,0,逃脱被挂,262093805
2872,2019,9,30,你于我。,0,溺水海员,537972671
2873,2019,9,30,在这尚好的青春里，真的没有你说的对与错，也没你说的谁不相信谁，更别说谁比谁更爱或者不爱。我一直以为爱一个人是给予一个人力量的，而不是那一份不安，不知何时开始了，这份不安不是说不相信某个人，这份不安是觉得自己已经不配做你那个爱人了，在你的生活中你已经把我抛弃了，把我落下了，,1,这个故事很美,117263782
2874,2019,9,30,泉州长大的，我们这偏向于前者呢，后者有点像晋江石狮那边的,0,melody-----,44616783
2875,2019,9,30,刚睡醒起来，天是灰蒙蒙的。可是没了以前的空落落与失望，在旁边的是自己的家人，同时还有那充满未知与期待的与他的未来,3,屁尧,555849899
2876,2019,9,30,"“希望得到世界允许，坦然一次喊你名字，再说爱意”
加油",5,摸仙女娃在线听歌,1472679669
2877,2019,9,30,希望你们能被大家所接受，我们一起加油,3,摸仙女娃在线听歌,1472679669
2878,2019,9,30,厦门长大的，我跟本地人学到的是xiǒng hè？好发音介于he和hou之间,0,逃脱被挂,262093805
2879,2019,9,30,睡不着的第七天[流泪],0,酷兒不酷之奶盐噜啦迪,298747140
2880,2019,9,30,曾经的好闺蜜 不好意思啊 七年之痒没能陪你熬过去,1,c旖巷,1367807904
2881,2019,9,29,要努力  要学习啊  要在别人看不到的地方善良，xiaojiejie,0,伤心猪大肠wj,1834681991
2882,2019,9,29,爱不应该后悔。,0,幻逝之魂,1599309539
2883,2019,9,29,"没有片刻不想你，
你是我的甜蜜和伤疤。",0,工藤夫人-,1786055725
2884,2019,9,29,老想哭，昨晚做梦梦见她了。找到这首歌，真的是想哭,2,谨言慎行安靖珩睿,25000917
2885,2019,9,28,已经石沉大海了 不会再想你 我付出的是青春不是后悔,2,masaki1024,133439999
2886,2019,9,28,不回来了 我得赶紧往前走啊 一辈子就这么长 要努力在有限的时间里更幸福一点啦,3,今天遇见可爱的女孩子了吗,277448298
2887,2019,9,28,我现在有男朋友了，他是我大学同学，他追我追了好久，我本想着他对我可能是一时兴起，我想，等他没了那份兴起可能对我就没有感觉了！我纠结了好久才答应跟他在一起。现在是异地恋，希望我没有选错他😬,2,凉凉凉菜包C,616577199
2888,2019,9,28,喜欢一个人时间长了，就会发酵变成另一种感情！暗恋同理，爱情也是如此，释放过后心也就空了！,0,丶归一,271110283
2889,2019,9,28,因为哥哥说 他觉得等待这个词最迷人,9,紫曰啦,76051845
2890,2019,9,28,喜欢了三年的男孩子要毕业了以后就再也看不见他了 我的青春 祝你前程似锦,4,小彭站不直,63628349
2891,2019,9,27,千万记得天涯有人在等你,0,小小志159753,349569732
