index,year,month,day,content,likecount,nickname,user_id7399,2015,7,27,我好像没有青春,2,蜻蜓队长zzz,66866690
7400,2015,7,26,等不来了～　他已婚 ,2,Manpropose_Goddispose,68018992
7401,2015,7,26,等到斟酌彼此酒杯的一天,1,abcdefg_abcd,3384144
7402,2015,7,26,啪~啪啪~,0,枝娅Y,17976397
7403,2015,7,26,"千万记得天涯有人在等你
风 再疾再狂我也不放弃",1,末田,39846361
7404,2015,7,26,kepler最后一场澳门，我们听哭了孙燕姿也唱哭了。,1,狗等天使,60007787
7405,2015,7,26,尚好的青春里有美好的故事,1,oblivious1234,56579046
7406,2015,7,26,看了你的评论我都忍不住抽自己了,1,Youkonowiloveyouso,51576704
7407,2015,7,26,喜欢你七年，从懵懵懂懂到刻骨铭心、从你不知道到你装作不知道，如今我身处异国才明了我早已把一生的爱都给了你，还如何去爱别人,0,要么爱我要么杀了我,36329632
7408,2015,7,26,[爱心],1,么么龟,82316563
7409,2015,7,25,[流泪][流泪][流泪],1,红薯拿铁527,44350136
7410,2015,7,25,再遥远，都跟随你。,2,朱盛东cape,37611246
7411,2015,7,25,尚好的青春都是你,1,TANGRUOCHEN,42389955
7412,2015,7,25,闽南语，还有一手歌天黑黑，发音是天哦哦,1,叽叽喳喳的二货,9329784
7413,2015,7,25,前几天是孙燕姿37岁生日。尚好的青春，渐渐远离。还在想，以前听电台里的遇见，然后总想着弄架钢琴弹前奏。,1,上离若水,65139261
7414,2015,7,25,我怎么听成了：尚好的青春弄死你，看来是我看得文章多了啊..,4,帐号已注销,38409341
7415,2015,7,25,😘,0,举个西木,60673274
7416,2015,7,25,[星星],1,灵犀一剑,60206257
7417,2015,7,25,特别喜欢，很暖心，很励志。千万记得天涯有人在等待，风再疾再狂我也不放弃,0,在歌里找自己,73346424
7418,2015,7,25,早晨醒来时脑袋里回响着这首歌。,0,悠闲的乌龟,44079963
7419,2015,7,24,尚好的青春都是你~~~生日快乐~,1,不穿袜子的人,32539043
7420,2015,7,24,听着歌刷着评论，好多暖心的小故事啊。然而……我又要写段子了！！这样的心情还怎么好好买蠢！搬砖时候不适合听燕姿啊，分分钟想滚回去浪[流泪],1,瑾筱轩,45694509
7421,2015,7,24,[撇嘴]又能怎样,2,artoriasAKA深渊漫步者,76593034
7422,2015,7,24,[色][色][吐舌],1,ROSARYMOON,68696914
7423,2015,7,24,用坚定的语气对你爱的人说，千万记得天涯有我在等你[爱心]也很棒吧,2,阿政正正正正正正,37040939
7424,2015,7,24,生日快乐，姐姐,3,大胃-贝壳汉肃,2062064
7425,2015,7,24,生日，Kepler，地球2.0 。[大笑],4,帐号已注销,16521570
7426,2015,7,23,生日快乐！,1,alexsongjian1993,565604
7427,2015,7,23,生日快乐！,1,RareSSSSSSSSSS,62096469
7428,2015,7,23,夜深人静的时候回味美好，太阳升起的时候继续奔波,2,大C君,78350389
7429,2015,7,23,生日快乐！,1,式的小被子,62023169
7430,2015,7,23,爱是爱 走是走 在一起是在一起 ／没有 过 有多好,1,李不想说,45322572
7431,2015,7,23,不想要 过,0,李不想说,45322572
7432,2015,7,23,燕姿 生日快乐。,1,枯燥妹,65292474
7433,2015,7,23,早安,1,小怪兽大战一休哥,46974469
7434,2015,7,23,早安早安,1,吹呀吹呀-,65754089
7435,2015,7,23,尚好的青春都是你，生日快乐,1,无邪浪荡睡衣姐妹,33871540
7436,2015,7,23,燕姿，生日快乐[亲亲][亲亲][亲亲],2,部落的滑翔翼,2839650
7437,2015,7,23,老大生日快乐,1,举个西木,60673274
7438,2015,7,22,[爱心],1,AIYOPIPIPI,80598948
7439,2015,7,22,1130,1,凉凉艾,221809
7440,2015,7,22,孙燕姿的歌就是特有感觉，虽然不曾听说她有多少事迹,3,忧忧城王子,69773270
7441,2015,7,22,就算给你的爱 石沉大海。嗯,1,看你睡得像个音符_,46748468
7442,2015,7,22,昨天他入伍了,1,不在这玩了大家再见,66489725
7443,2015,7,22,两个字 很好听,1,FANXUWEn,12725233
7444,2015,7,21,@妳猜我猜不猜喔,0,KakaLoveJay,57661667
7445,2015,7,21,很适合异地恋人。,0,KakaLoveJay,57661667
7446,2015,7,21,滂沱大雨不曾见证海角相偎依,1,温暖的番茄酱,38586411
7447,2015,7,21,[狗][猫],0,我喊了听见没有,77925115
7448,2015,7,21,怎么办，唱得太感人,1,Larcissus,2943237
7449,2015,7,21,难听,2,顾及他,51082292
7450,2015,7,21,千万记得天涯有人在等待,1,桥豆无麻袋,45513486
7451,2015,7,21,终究在尚好的青春里失去很多。,1,依然毛线成团,64666227
7452,2015,7,21,一直以来听哐哐的英文歌，心也浮躁不安，听到这首歌让我重新安静下来。尚好的青春里，我做错很多，错过很多。,2,依然毛线成团,64666227
7453,2015,7,20,都是你,2,电脑卡住了,48203968
7454,2015,7,20,去年毕业，在走之前一天和她去看了燕姿的演唱会，她最爱的燕姿，听这首歌哭着靠在我肩上，而我假装这离别的日子并不痛苦，离别对于我们总是匆匆，青春对于我们总是遗憾，不知道她现在还过得好不，至少她应该还爱着燕姿。至少我和她的回忆还在那里。,7,Adieu不是告别,59011087
7455,2015,7,20,我没有故事，但我喜欢这歌,6,贰三七伍,43250401
7456,2015,7,20,真残忍,1,不穿袜子的人,32539043
7457,2015,7,20,多彩的生活，痛楚的青春～关于岁月，这首歌是最好的鉴证～,1,桂林光之翼舞台服装租赁,71538065
7458,2015,7,19,孙燕姿，尚好的青春都是你。,0,漠派,72269066
7459,2015,7,19,去年循环了许久的歌曲 现在再次捡起 只为找回去年听这个歌的回忆[流泪],2,凌菊微步啪啪啪,40538278
7460,2015,7,19,"我想说，我来过。
                 即使天无雨，我亦在此",1,Shiux,9925165
7461,2015,7,19,尚好的青春都是你，没有片刻不想你,1,Moonoon_s,44401181
7462,2015,7,19,没经历过，就不知到那会有多铭心。爱之深才伤之切。,1,Cagurls,57342479
7463,2015,7,19,真够矫情啊 鸡皮掉一地,3,夜觅宇宙,59936107
7464,2015,7,19,就算给你的爱石沉大海,1,大烧酱,41179944
7465,2015,7,18,等,1,如果你爱我你会来找我_,79392370
7466,2015,7,18,46''处，注意力全部被抽出…,1,Hahalooo,64618480
7467,2015,7,18,对啊。我奇怪燕姿不是客家人么。,1,杳渺星河月半轮,49461779
7468,2015,7,18,这是闽南话,1,natureQ_,954119
7469,2015,7,18,拢系你？？？不是客家人么。,0,杳渺星河月半轮,49461779
7470,2015,7,18,好想听一次你的演唱会，然后唱这首歌。,1,毛毛lovelife,38084191
7471,2015,7,17,"千万记得天涯有人在等你…风再急再狂我也不放弃…愿为你直到有一刻能守着你的心…就算你不会懂也不会可惜…千万记得天涯有人在等待…路程再多遥远不要不回来…不去想不去计量你的心有多明白…前往幸福的路有多少阻碍…就算给你的爱石沉大海…青春飞逝再不回来… 
耳边循环了一年多的歌…终于… ",3,Miss若涵,72883319
7472,2015,7,17,终是燕姿最抚慰我心,2,阿根廷小蓝,46806014
7473,2015,7,17,千万记得天涯有人在等你，风再疾再狂我也不放弃，希望旅行再疲惫再遥远不要不回来……,1,Rea流云,44129259
7474,2015,7,17,我的初恋也是7年,1,EXPOSE_,32354797
7475,2015,7,17,喜欢一个人大抵就是觉得配不上他，想接近却又卑微得小心翼翼，却也有了为喜欢的人而努力变得更好的动力和勇气，无论最后能否走在一起，至少曾有个人的出现让你一点点接近自己想成为的样子，何尝不好呢,5,她她她哎,71468537
7476,2015,7,17,尚好的青春都是你,0,小男僧的大世界,51358438
7477,2015,7,17,封面和歌有点不搭,2,下一秒在哪,53879494
7478,2015,7,16,尚好的青春都是你 没有片刻不想你,1,Mintbacca,53543628
7479,2015,7,16,好装,1,说你的故事,51786640
7480,2015,7,16,就算给你的爱石沉大海，青春飞逝就再找不回来。,1,橘子糖的吻,80055967
7481,2015,7,16,和前男友分手之后他让我听的。每次听都会想起他，而且越来越能体会他的感受，是我辜负了一个深情的人。愿你从此幸福。,3,夏日薄荷之味,75668311
7482,2015,7,16,哈哈,1,haoba211,80321695
7483,2015,7,16,你的感受？,0,haoba211,80321695
7484,2015,7,16,尚好的青春都是你,0,举个西木,60673274
7485,2015,7,16,"""尚好的青春都是你 没有片刻不想你""
Goodnight, my darling.🌙",3,短毛君,37737784
7486,2015,7,16,就算能在对的时间遇见对的你，遗失的青春怎能回得去。,3,戈多今天来了阿,70351583
7487,2015,7,16,两分钟。,0,柒滢_陳文静_,59286326
7488,2015,7,16,千万记得有人在等待,0,茂名陈冠希,63043967
7489,2015,7,15,心底还是我姿最能抚慰人心,3,你说今天天气好不好,53063419
7490,2015,7,15,[流泪],0,不在这玩了大家再见,66489725
7491,2015,7,15,不去计较你的心有多明白,1,cccmcm,73371709
7492,2015,7,15,😂那就没办法了,2,小二桅,38810717
7493,2015,7,15,表白失败了。但是我也想说 千万记得天涯有人在等你。,2,帐号已注销,65647121
7494,2015,7,15,[大哭]]那要是17.8岁没爱上过人呢,1,芜芜归未归,26961868
7495,2015,7,15,别这样，这么煽情,1,小丞砸的工作日记,47529004
7496,2015,7,15,好啊[憨笑],1,在路上_向着梦想前进的男人,71212778
7497,2015,7,15,出国就不回来了吗  然后呢,1,-RicKcHan,73800167
7498,2015,7,14,千万记得天涯有人在等你～（然而是等你交份子钱[便便],1,瓦远溪,29907140
7499,2015,7,14,等你   陪你  想你  爱你  宝贝,1,爱上一个傻媛宝宝,67826186
7500,2015,7,14,曾经听哭过，后来真的就是石沉大海了,1,星夜星空,73734053
7501,2015,7,14,"尚好的青春都是你
没有片刻不想你
就算能真在对的时间 遇见对的你
遗失的青春怎能回得去……
听到泪……",1,猫夕夏,63851065
7502,2015,7,13,千万记得天涯有人在等你,0,__Rventric,51180261
7503,2015,7,13,我一唱孙燕姿的歌就像喘不上来气是的 在嗓子眼里唱 哎,1,椰子insane,45271053
7504,2015,7,13,千万记得天涯有人在等待,1,今漳,44032483
7505,2015,7,12,没有片刻不想你，,1,爱吃火锅的乌鸡卷,45882842
7506,2015,7,12,我怀念的》和尚好的青春》都太走心，夜深人静时千万别听,4,迟某某,40702454
7507,2015,7,12,路程再多遥远不要不回来.,2,0l03,78996753
7508,2015,7,12,做好一件事，只爱一个人,2,大白很白-21,13962570
7509,2015,7,12,@天阶夜色凉如水clearlove ,2,开心洪小芬,2564415
7510,2015,7,12,千万记得天涯有人在等待！,1,小狗狗的大狗狗,72467531
7511,2015,7,12,若滂沱大雨 不曾见证 海角相偎依，衣角怎么会 湿淋淋。,2,魑魅格格巫,18916442
7512,2015,7,12,千万记得天涯有人在等待,1,大白象shine,47540306
7513,2015,7,12,所以说十七八岁爱上的人会是你这辈子最爱的人啊,0,小二桅,38810717
7514,2015,7,12,就算真能在对的时间遇见对的你，遗失的青春怎能回的去[哀伤],2,牛团团-,79246956
7515,2015,7,12,就算站在对的时间遇到对的你，遗失的青春怎能会得去…[流泪],1,她在丛中笑26825642,57142186
7516,2015,7,12,"我去过那个城市 去的原因就是为了她最想上的大学 川音 也在那个城市把她留在那 也包括我的心 春熙路我多么想和她一起逛逛...
",2,YOUNGGENIUS,3315784
7517,2015,7,12,就算给你的爱，石沉大海。谢谢燕姿，我明白啦[可爱],1,elefant-noonnoon,41311080
7518,2015,7,12,亲爱的～我会好好学，下次见面的时候唱给你听@在路上_向着梦想前进的男人,1,陆九喜,32991529
7519,2015,7,11,看澳门站的秒拍，姿妈唱哭了，我也哭了[流泪],1,克卜勒的小叶子,18281935
7520,2015,7,11,尚好的青春都是你，Kepler巡回再见了。我知你会回来，我等。千万记得天涯有人在等你。,2,米立echo,52286974
7521,2015,7,11,"
你这样吹过 
清凉，柔和 

再吹过来的 
我知道不是你了
",2,两个哑巴o,42023173
7522,2015,7,11,[流泪][流泪][流泪][流泪][流泪][流泪],1,话梅_amei,69670636
7523,2015,7,11,青春飞逝 就再找不回来,1,我是小M酱,18470253
7524,2015,7,11,[亲亲],1,帐号已注销,66642646
7525,2015,7,11,明天回家,0,举个西木,60673274
7526,2015,7,11,有很多事不必解释，时间会让你懂事[可爱],2,Mua-mia-123,50784303
7527,2015,7,11,十三姐 今晚见[亲亲],1,乔豆玛袋,35806306
7528,2015,7,10,再遥远，都跟随你！,0,图芽芽,69386995
7529,2015,7,10,再遥远都跟随你…,1,AmorFati_koala,50682148
7530,2015,7,10,上个月燕姿演唱会，想找人陪着去,1,如如露亦如电,64172724
7531,2015,7,10,广东潮汕地区也能听懂一点闽南语滴 和潮汕话也挺像,1,Vichy_Chen,53609173
7532,2015,7,10,千万记得天涯有人在等待~,1,keys-QYL,75868611
7533,2015,7,10,干嘛这么悲伤,1,忘却迷离,43883816
7534,2015,7,9,@木易-Ason 今天遇到了不太好的事,1,freedom_cccr,74845439
7535,2015,7,9,啥时候还有英语了,0,无印良痞,33890876
7536,2015,7,9,在家的感觉真好，[吐舌],1,ShaneYen,18064653
7537,2015,7,9,这是闽南语。。,0,Vichy_Chen,53609173
7538,2015,7,9,原来[强],0,小千子,55823810
7539,2015,7,9,永远忘不了柯景腾的那句“新婚快乐，我的青春”。,3,imsea_,64441667
7540,2015,7,9,两年半了，你毕业了，我还有一年，昨天送你到机场，其实还有好多话都没有说，以前没觉得时间过得快，可现在只觉得时间太短暂。未来太渺茫，不知道会不会在一起，也不知道以后在哪里工作，但一切都抵不过我爱你，不管怎么样，我会努力，一直等你。,3,无聊的泡泡705,47143890
7541,2015,7,9,闽南话,2,rue-peismall,76203997
7542,2015,7,9,风再疾再狂  我都不会放弃    我要为你守着一颗心   to  TP,0,rue-peismall,76203997
7543,2015,7,9,"666,我喜欢！",1,Authoritoe,70792041
7544,2015,7,9,总觉得尚好的青春都是你这句发音很奇怪,1,小千子,55823810
7545,2015,7,8,太悲伤,1,halogenic,62046597
7546,2015,7,8,啊啊啊啊啊啊啊啊啊啊啊啊啊啊啊啊啊啊啊[色],1,平平平平平平平平平,77885439
7547,2015,7,8,还是会喜欢她的声音，在众多声音中，还是会分辨出来，就是不喜欢改变，上次去买商品，朋友嬉笑我老是选择同一家商店，殊不知其实有更适合的，适合，有些或许会很适合，就是要选自己喜欢的，肿么样，你咬我啊！,2,暴唯唯,52310131
7548,2015,7,8,前两句就有点鸡皮疙瘩出现，感人的曲，动心的唱，回顾的忆，现今的己,1,用户76621136,76621136
7549,2015,7,8,就是华理的,1,阴雨总有晴y,44694611
7550,2015,7,8,千万记得天涯有人在等你[口罩][口罩][口罩],1,深海里的小王子,19134848
7551,2015,7,8,[呆]不会是华理的吧,2,大陆的陆,52913597
7552,2015,7,8,[流泪],1,千颂伊i,7810348
7553,2015,7,8,就算你不会懂 也不会可惜,1,帐号已注销,37674170
7554,2015,7,7,尚好的青春都是你。,1,Vincheer,32333860
7555,2015,7,7,尚好的青春 都是你,1,善生Ele,68786708
7556,2015,7,7,有人在等你,1,我小名叫吃得多,49282273
7557,2015,7,7,第一次听这首歌是一个关系很好的学长离开奉贤的时候和女朋友一起唱的 然后就记住了 现在我也要离开奉贤了,0,阴雨总有晴y,44694611
7558,2015,7,7,同城,1,突然打雷,30525074
7559,2015,7,7,好喜欢她的歌,1,mikymtt,30841042
7560,2015,7,7,就算能真在对的时间遇见对的你,1,我要新生活,22690285
7561,2015,7,7,07.7.7-15.7.7 ,2,尚小蹄儿,61127745
7562,2015,7,7,晚安[爱心],1,要纸吗,44408457
7563,2015,7,6,对的时间，对的人。你在哪儿，能等我么？,1,q小秦24,25236080
7564,2015,7,6,对的时间，遇见对的你。遗失的青春怎么回得去。,1,real孙雪,78839220
7565,2015,7,6,我等了你这么久 可是我也没办法 你现在回来太晚了 真的太晚了啊 所以你回家吧,1,keenyyyyy,49663717
7566,2015,7,6,因为一句词，爱上一首歌,3,用户76045316,76045316
7567,2015,7,6,有缘还会在一起的，要相信！,1,潘女花,57367541
7568,2015,7,6,对，,0,潘女花,57367541
7569,2015,7,6,尚好的青春都是你,0,图芽芽,69386995
7570,2015,7,6,如果你是手打的这句话的话你一定很用心，如果这句话是你自己的经验领悟，你一定很有故事。,1,阿南561,53264562
7571,2015,7,6,分开的时候会把所有好的事情忘记只有当时的感情,1,X某某人,56361421
7572,2015,7,5,或许我会花大半生和自己谈一场柏拉图之恋,1,wulongshen,37723834
7573,2015,7,5,我的初恋喜欢的是  苏打绿   一样的感觉,0,EXPOSE_,32354797
7574,2015,7,5,失恋了之后好像所有的情歌都听得懂了都有共鸣了。,3,大王叫我233,73819350
7575,2015,7,5,再遥远都跟随你[憨笑],1,孙燕姿kepler_,74997392
7576,2015,7,5,一双鞋刚买的时候蹭上一点灰都要蹲下来擦干净，穿久之后即使被人踩一脚可能也很少低头，人大抵都是如此，所以最初她皱一下眉你都心疼，到后来，她掉眼泪你也不大紧张了，他当初初恋唱这首歌跟我表白，以为很爱，后来还是轻易说了不爱，分手后再也不敢听，今天再听已经没有了眼泪，惟愿你在远方安好。,15457,一只学渣真奇怪,70695563
7577,2015,7,5,我终于知道毕业生晚会那个唱歌很好听的学姐唱的歌叫什么了,3,求不重名,16183572
7578,2015,7,5,在金矿奶茶店听到的，记了句歌词，回来百度,3,直布罗汉,9601187
7579,2015,7,5,昨天听了之后我梦到你了，虽然哭得那么惨烈，梦里的我还抱着你。然后无措的醒来。今天我还想梦到你，在或许的另一个平行时空中，我们在一起。,100,杀西风,51110162
7580,2015,7,5,凌晨里听着燕姿的演唱会，就很容易伤感，到这首歌时哭的最惨。千万记得天涯有人在等你，风再疾再狂我也不放弃。,2,翠-镇长,42823964
7581,2015,7,4,燕姿的歌都是那么动人那么好听,1,jackfeilee,863162
7582,2015,7,4,之前一直都感觉这首歌很一般，直到半个月前去了燕姿的演唱会，听到她现场唱，然后突然就被感动的一塌糊涂,3,1amfallasleep,52543820
7583,2015,7,4,真好听,1,更美之约12,78327087
7584,2015,7,4,每一个人在心里都有定格的画面。她、她、她和她。第一个念头的她，又是什么样子,1,鼎哥哥有个小女儿,76225905
7585,2015,7,4,无奈 只能石沉大海,2,榴蓮葡萄,36857362
7586,2015,7,4,风，再疾再狂，我也不放弃。,1,迷彩Queen,72868602
7587,2015,7,4,[哀伤][哀伤],1,刘-岚-钦,68944477
7588,2015,7,4,@黑妹妹耶,0,帐号已注销,52143512
7589,2015,7,4,每次听到这么感性的歌，就会提醒我不管多拼命，不要忘了什么是真正的自己,1,玻玻玻,60920582
7590,2015,7,3,为什么不能让我早三年认识你...以至于现在对你说一声生日快乐都显得唐突和多余...月光洒落在这个原本属于你不属于我的城市和大地...可是我知道那个喜欢孙燕姿唱歌很好听气质独特的女孩子，不在这里...,3,JAMFER1985,48900308
7591,2015,7,3,晚安  米娜桑  ~~[亲亲]   尚好的青春  有你  有你们  [爱心]希望未来还是一片希望的模样    .....[强]   晚安   .......      ........ 晚安   ........   今晚话很多啊  .............    晚安......       安  ~~~~~~~~~~~~~~~~~~~,1,用户37642586,40699166
7592,2015,7,3,作为最后一个奔向新征程的，突然觉得这像是一个陌生的城市。愿各自安好、愿再见无恙。,2,长腿静蜀黍,49328569
7593,2015,7,3,千万记得天涯有人在等你~~,1,去夏_,33818553
7594,2015,7,3,千万记得天涯有人在等你~~~,0,去夏_,33818553
7595,2015,7,3,[哀伤],0,不在这玩了大家再见,66489725
7596,2015,7,3,千万记得天涯有人在等你,1,lingjunli,3463705
7597,2015,7,3,青春里全是你。,2,李秋雨呀,44431676
7598,2015,7,3,千万记得天涯有人在等你 风再疾再狂我也不放弃,1,胖伦最爱喝的奶茶,67715058
7599,2015,7,3,抱抱,1,檬小鱼,37671379
7600,2015,7,3,有你，这份爱，才尚好。,0,檬小鱼,37671379
7601,2015,7,2,[爱心],0,用户37642586,40699166
7602,2015,7,2,听到这首歌还是忍不住眼泪哗啦哗啦滴,1,用户36507753,36507753
7603,2015,7,2,与君一别，无痕无缘,2,哥伦比亚特区的我,35869273
7604,2015,7,2,从@恍然如梦------ 淘的，今天才知道是天涯社区宣传曲[大哭],1,杰信哲,38247837
7605,2015,7,2,"就算给你的爱 石沉大海
青春飞逝就再 找不回来",1,kacuha,42649513
7606,2015,7,2,天涯海角等我的人在哪里。,1,咕咕咕咕咕咕叫顾顾,66524461
7607,2015,7,2,@我真的很有程艺 好听吗,1,zxholy,40182888
7608,2015,7,2,你也会那么幸福的[憨笑][憨笑],1,马尔克思魔幻现实主义写作方法,40537534
7609,2015,7,2,尚好的青春都是你，没有片刻不想你。,2,哈喽喵先森,50056134
7610,2015,7,2,好羡慕，好幸福啊[大笑],1,左眼看世界_,9918642
7611,2015,7,2,The Best Days of My Life. @靖儿_ ,1,Mono__,51042309
7612,2015,7,2,有段时间都不敢听燕姿的歌、,2,我命孤独,60841404
7613,2015,7,2,尚好的青春都是你，没有片刻不想你，好霸气[惊恐],1,胖子hi,72424258
7614,2015,7,2,老公竟然唱了这首我默默听了很久的歌哄我睡，真的好暖[牵手],291,马尔克思魔幻现实主义写作方法,40537534
7615,2015,7,1,其实，不开心。,1,surreal_moga,62853402
7616,2015,7,1,第一次听这首歌是这学期刚开学礼拜一下午没课去ktv 阿婧唱,1,一碗甜粥三分糖,77939582
7617,2015,7,1,才不要这么悲伤。,0,我要赖在被窝天长地久,63512682
7618,2015,7,1,千万记得天涯有人在等待。,1,Eshellenn,11561670
7619,2015,7,1,我觉得会计可以找人统一战线。。,1,小小小道道,74035690
7620,2015,7,1,看评论多心碎,1,rockylong,56917716
7621,2015,7,1,评论多心碎,1,rockylong,56917716
7622,2015,7,1,@_南风知我意___ [流泪]被会计虐得要哭了,0,不在这玩了大家再见,66489725
7623,2015,7,1,[呆],1,柒个我,67116715
7624,2015,7,1,该给的刀子何必隐藏，笑喷[大哭][大哭][大哭],1,正当冬夜渐暖,48932527
7625,2015,7,1,青春快完了我还一直单着[流泪][流泪],2,三三知道了,8684451
7626,2015,7,1,可能他们在演戏，毕竟一般一般都没信号，哈哈哈哈,0,三三知道了,8684451
7627,2015,7,1,青春不散，永在吾心。内有片刻不想你[爱心][爱心][爱心],1,Wuli小小白i,33228547
7628,2015,7,1,7月,1,EstrellaMomo,64391558
7629,2015,7,1,唉  现实很重要 总要往前看,1,消失踪影,29814634
7630,2015,6,30,千万记得天涯没人在等你,1,zskmusic,39831475
7631,2015,6,30,过去难以忘怀，但对未来 再也没了期待,1,与隐,52524579
7632,2015,6,30,在天涯论坛等你,1,heavenbadgal,48446138
7633,2015,6,30,天涯有人在等你吗？,1,晴天娃娃-VERA,47656740
7634,2015,6,30,燕姿等我，我一定要去你的一次演唱会，我现在没钱,4,帐号已注销,77370741
7635,2015,6,30,"若滂沱大雨 不曾见证 海角相偎依
衣角怎么会 湿淋淋",2,wing喵,71962595
7636,2015,6,30,正在看天涯八卦的我听到『千万记得天涯有人在等你』心里一惊。。。。,2,鸡婶,39123439
7637,2015,6,30,天涯真的有人在等?,1,大木老师吗,37661532
7638,2015,6,30,"长长的火车隧道 拉着那一去不复返的青春 让脆弱的再见声响得那么彻底又不舍 明天 一切安好 
     尚好 只是尚好。[女孩][女孩]妮 以后有机会再见了 这里 有机会再见了……………",2,own时光,75309833
7639,2015,6,30,看评论虐成狗[大哭],3,Roger-LJJ,59802725
7640,2015,6,30,耳机里放着这歌，在动车上哭的不行。千万记得天涯有人在等待，路程再多遥远不要不回来。尚好的青春都是你们。再见了。,3,嘿_柚子小姐,39671005
7641,2015,6,30,就算能真在对的时间遇见对的你 遗失的青春怎能回得去 我们的相遇大概就是那句 你好 再见 心痛,1,抽抽ssss,55989699
7642,2015,6,30,就算你不会懂也不会可惜,1,Hwast,37890470
7643,2015,6,30,"若滂沱大雨 不曾见证 海角想偎依…
千万记得天涯海角有人在等待。
晚安。",1,nnnnonon,54076371
7644,2015,6,30,我特么在不下20首歌见过你了！！！！！,6,帐号已注销,42564402
7645,2015,6,30,愿为你 直到有一颗能守着你的心 就算你不会懂也不会可惜   多少次在深夜听到这首歌还是会哭，那些美好的时光都有你的陪伴，谢谢你陪了我这么久，遗失的青春回不去了，我们都要继续向前走了，我们都要好好的，直到下一次再遇见，孙燕姿，我爱你，很爱很爱，很久很久,1,AFSKONG,40051597
7646,2015,6,30,这大晚上的。。。,2,-灰太狼的美羊羊,6700754
7647,2015,6,30,一句“毕业快乐”也没敢对你讲，认真喜欢过的人不敢无理取闹，不打扰可能是最好的状态。毕业快乐啊~只能在这里讲了[流泪],4,-灰太狼的美羊羊,6700754
7648,2015,6,29,😭😭😭😭,1,大饭爱吃鱼,19691547
7649,2015,6,29,。,0,EstrellaMomo,64391558
7650,2015,6,29,我并没有什么恶意，一直觉得孙燕姿该长多点肉。,4,wechanged,12823008
7651,2015,6,29,单曲循环千千万,3,追来者,36269565
