index,year,month,day,content,likecount,nickname,user_id
1,2019,11,7,那么好听，打卡阿美,0,女王陈萍,580710290
2,2019,11,6,嗯,0,Byebyebluee,557948495
3,2019,9,29,加油加油，别人都可以我一定也可以的！！！,0,xiaoxiaomiJoyce,394417521
4,2019,9,25,这是他们两的专辑，看封面上有遇见和我要快乐两首歌，还有两个女人[大哭][大哭][大哭],2,我有一块小饼干,333348483
5,2019,9,24,我不会为了留你假装可怜兮兮,0,-L3c,264775796
6,2019,9,23,评论少，大概因为太难唱了吧...哭,0,啦啦就你的哦对金额和,248575130
7,2019,9,4,为什么出现在孙燕姿的专辑里,0,热苏打vv,492015258
8,2019,8,5,还是熟悉的封面[爱心],0,生生嘻嘻,354555314
9,2019,7,27,这个评论真的出乎意料的少诶,1,融化在左心房的方糖,257089310
10,2019,7,25,"我本想去地狱，可是地狱打烊
便转身走去天堂，但天堂也客满
于是我路过人间，正好你房间正通亮",1,帐号已注销,294581337
11,2019,7,11,这首歌好难唱😂,0,程是非0403,111382519
12,2019,7,5,不能放纵爱你 就放过自己,0,一罐热茶AAAlice,246097131
13,2019,6,21,居然这么少的评论,1,陈从雨,325529357
14,2019,6,9,好听，评论好少，那就在这里表白严小姐吧，我喜欢你，永远没有厌倦期。,0,拉lal拉,538627939
15,2019,5,26,你有我说也说不完的坏脾气，然而。。。那又怎样！！！依然爱你,1,随-鑫所欲,110355857
16,2019,5,26,这歌我15年还是16年就开始听 到现在评论怎么还那么少…,1,nynnX,384688516
17,2019,5,3,唱功恐怖,3,依然渐飞,44419218
18,2019,4,28,风，那是爱你的欢笑,1,健淡的小花,95933025
19,2019,4,24,明明很久以前就觉得很好听的歌，结果今天一看评论不到三百，迷惑,2,奸商十二,354221696
20,2019,4,3,这首歌为什么在孙燕姿唱歌歌列表里面,2,米卡米卡小米卡,266506983
21,2019,3,5,还不是怪自己不够争气，没能让你也喜欢我…,2,Nevaeh丸子-,35441202
22,2019,2,13,好听,0,木易天马乔,89923393
23,2019,1,2,我喜欢你，千疮百孔也还是放不下你。一次又一次地重蹈覆辙，也还是喜欢你。,3,Beaatrice,588349459
24,2018,12,8,冷门好歌,0,橘子树上的小朋友,9049829
25,2018,11,30,我恨 爱你的软弱的不堪一击的我,0,Vionn,124738787
26,2018,11,16,再见xy 不会再去到你的城市找你 不会再爱你 一切到此为止 你与我再不相关 谢谢,0,巧克力派的汉堡包,405191492
27,2018,8,26,阿妹的冷门好歌。,5,局外人gsy,287214378
28,2018,7,31,嗯啊,0,mouft_hu,260036758
29,2018,7,28,同城呀,0,我什么时候能像你一样优秀,251875976
30,2018,7,27,广播听到的，还蛮有感觉,0,树树不想被发现啊,278569244
31,2018,6,20,没有爱的人 没有恨的人 ,2,mouft_hu,260036758
32,2018,5,7,I hate myself for loving you ,0,在演出结束之后,104865868
33,2018,5,4,i hate u i love u???,4,FR172,311235493
34,2018,4,13,"我有你拿也拿不走的旧回忆。
我可以一个人安静的忘记你。",2,桥豆麻袋库达塞,287056288
35,2018,4,9,我恨我爱你！特别恨……为什么忘记一个人这么难，明明已经不爱了啊，我真的不爱你了啊,1,MorisLu,289517545
36,2018,3,19,为啥这么点评论？,0,fayekie名字被偷了,131574363
37,2018,3,16,错失良机,0,欲言仍不语,117631306
38,2018,3,16,"你有我看也看不清的小聪明
你有我说也说不完的坏脾气",0,木头木头脑袋,61922577
39,2018,3,14,可以说…hin惨了,0,miss巫月,303304336
40,2018,3,12,261打卡！居然和上一个相隔7天，明明那么好听！！,0,承包西瓜jun郑容和and魏无羡,77875014
41,2018,3,5,260打卡🙋,0,元气少女依琳xi,334980204
42,2018,2,22,多说无益,0,BROKEN4u,373329190
43,2018,2,7,这首歌的评论竟然这么少！,0,哆啦A末,301064728
44,2018,2,4,这不是原唱吗,0,短毛矮瘦子201706,487501010
45,2018,1,31,单身狗连个恨的人都没有🤷🏻‍♀️,3,-屿岛-,323058112
46,2017,12,29,我恨我 爱你,2,何木子麻麻,479763758
47,2017,12,24,"我  恨我爱你  我恨 我爱你  我恨我 爱你
",2,梅瑞兹格的沉默,105214969
48,2017,12,22,抱拳儿了 老铁,0,MarrBe,42372968
49,2017,12,21,你好，同城,0,Yesim海绵宝宝的宝宝,442743838
50,2017,12,10,一点小伤而已,0,是JayHu,119787692
51,2017,12,7,喜欢是小心，爱是煎熬,1,YUSUKE阿,128950163
52,2017,12,4,这首歌怎么这么少的评论。超好听唉。,2,gilig,292691563
53,2017,11,30,阿妹的歌应该全都999+的,1,李雅曼妮y,290176176
54,2017,11,23,一模一样的故事[大笑],0,进击的楼儿,257852142
55,2017,11,20,难过,0,Lo1ita,49234836
56,2017,11,14,是我推开你的  可为什么难过的是我自己,4,施选手就位,112624116
57,2017,11,12,[狗],0,爱吃鸡排的YL-,628929290
58,2017,11,10,"原来你对我说的那些都是一个一个的歌名 花一开满就相爱 我恨我爱你
我也恨 我爱你",0,MarrBe,42372968
59,2017,10,31,我也是[大哭][大哭],0,你益爷,67743576
60,2017,10,30,我接受不了,1,今天天气可真冷啊,630895680
61,2017,10,28,10月28日，四天了，我从图书馆回来拿着杂粮煎饼，听着这首歌，阿表哥打电话来说潘姐姐生他的气，我哪有心情理会。挂完电话我走向宿舍，听到都怪我太不争气这句的时候泪崩。三年了，你对这段感情确实付出很多。不过就是你在郑州受不了异地恋要离开嘛……难过是一时的，OK我还是很爱你。—写在成都,2,多半是你,361543734
62,2017,10,26,这么少评论？？？竟然还都是最近的？？？想知道发生了什么,0,很远之前,73423052
63,2017,10,24,渣男无误了,1,后海老鲨鱼,48574365
64,2017,10,23,早点睡吧 总会过去的,0,AlterfYiu,89394188
65,2017,10,23,凌晨四点看到这条评论真是心塞,0,僵尸捕食者,317876164
66,2017,10,15,睡不着 都是因为你,2,-黄濑,33638329
67,2017,10,14,他不值得你爱。你会遇到那个把你捧在手心里的人的,1,MozzzzZie,545527777
68,2017,10,12,你先出的轨，但我不知道 然后你说真的很爱我，所以我又慢慢陷回去，但后来你又背着我和另一个人一起，你说你爱我，但你说不能再一起了。最后你有别人，我只有我。 ,3,AlterfYiu,89394188
69,2017,10,8,巧了,0,湮没1010,533280669
70,2017,10,7,我恨我爱你  加油 武汉,1,李易峰永远都得不到的女人,500416019
71,2017,10,6,彼此彼此,0,地表最正,255901622
72,2017,10,4,巧了兄弟,2,过儿的小龙女啊,382904645
73,2017,10,4,你也一样吧[奸笑],1,地表最正,255901622
74,2017,10,4,头像厉害了，一人一半是嘛？      ,0,过儿的小龙女啊,382904645
75,2017,10,4,我哪也不去，就在中国等你回来[大笑],1,地表最正,255901622
76,2017,10,4,这首歌前奏一响起就突然觉得很熟悉，阿妹的第一个字蹦出来的一瞬间，几年前因为你而接触这首歌的心绪突然展露。你还好吧，明年你去你的澳洲，后年我去我的加拿大，有缘再见吧,1,过儿的小龙女啊,382904645
77,2017,10,3,哇，我是听完蒙面唱将过来的。[呲牙],4,zMG7,267680019
78,2017,10,1,多说已无益,0,啊墨喵,94525945
79,2017,9,30,嗯,0,Cornichonnn,252064840
80,2017,9,25,太夸张了吧？这首歌这么少？？现在的人听什么歌啊,5,别融hua了眼泪,132399787
81,2017,9,25,嗯？,1,别融hua了眼泪,132399787
82,2017,9,6,手机和电脑换了好几个，唯一不变的是要存这首歌,2,Law君,399596526
83,2017,9,1,why？,0,neoiswoa,447376358
84,2017,8,30,评论这么少不科学啊 ,2,Rap小王子_,257615238
85,2017,8,27,听了心碎的歌。,1,阿尔弗雷德丶狗蛋儿,70085256
86,2017,8,25,评论竟然这么少,0,我的名字叫不高兴,246115840
87,2017,8,25,这么有故事的歌。不999都奇怪了,0,vivalahm,92371481
88,2017,8,19,好想哭T﹏T,1,浓了伊人醉,549099751
89,2017,8,14,放过自己,1,陈射射同学,439399974
90,2017,8,11,你有我看也看不清的小聪明，你有我说也说不完的坏脾气，你有我数也数不尽的新恋情  [心碎][哀伤],2,x_7777,257339744
91,2017,8,11,放过自己,2,可以不鸽了吗,276764891
92,2017,8,8,希望你别是风  在我这里掀起了万般波澜  却又跟着云去了远方..,2,_遗憾够,282710814
93,2017,8,8,原来浮生万物里  所有重逢都不如初遇.,2,_遗憾够,282710814
94,2017,7,29,我该什么时候放过自己。,1,多年以后89,274721712
95,2017,7,27,我失恋的时候，全靠这首歌……,1,里特儿扬,300645850
96,2017,7,18,换封面啦,0,从某一颗星星诞生,102484127
97,2017,7,18,这首才这点评论？？？,0,塞洛洛洛里塞,535436040
98,2017,7,17,我知道你不够爱我也不够在乎我，有没有我都无所谓，可我依旧是那么爱你，放不下也离不开……,1,沈露西,323256062
99,2017,7,11,“你有我看也看不清的小聪明 你有我数也数不尽的坏脾气”一句词粉上一首歌系列～,4,汇砖,260637481
100,2017,7,7,都怪我太不争气,3,-怪客GEEK-,98562882
101,2017,7,7,不如还是算了,0,Jecxxx,113859963
102,2017,7,7,这么久了 真快啊 都爱了你这么久了,1,Jecxxx,113859963
103,2017,7,5,心雨啊,1,爱喜你事,83872181
104,2017,7,5,送你,0,Jecxxx,113859963
105,2017,7,5,i hate i love u,0,19_And_Life,296114819
106,2017,7,5,你一次一次的伤我的心，我却始终还是放不下你，我恨我爱你！我恨我爱你多过爱自己！,3,沈露西,323256062
107,2017,7,4,下面这条我想上热门让他看到,0,足幺班昭,133683718
108,2017,7,4,邓智超 谢谢你正在陪我走最难的日子，我爱你。[爱心],2,足幺班昭,133683718
109,2017,6,30,你太不争气,0,苏三伞,111844957
110,2017,6,29,我还在恨你，你已经开始了新恋情。当初没有为了留你，假装我可怜兮兮。现在我真的可怜兮兮，你却不会再心疼一下了。,2,lonozhi,399607151
111,2017,6,25,啊妹这嗓音绝了,3,一只九九乄,356831872
112,2017,6,21,你是🐷然而我喜欢🐷,1,猪粉啊,134094435
113,2017,6,21,才这点评论。。没被挖出来就好,0,canyoumeetme,59730791
114,2017,6,20,我能告诉你 们我的新恋情吗，我很爱她！,2,回头太难98,259100325
115,2017,6,16,都怪我太不争气,1,胡桃卷-,122104323
116,2017,6,13,我也有自己的生活，放过自己吧,0,黄河流域第一才子转世,492573990
117,2017,6,10,有什么办法呢，就是喜欢啊。,0,宋宋宋宋宋-大婷,105249257
118,2017,6,6,这首歌的评论居然没有999+,2,elationsea,53372838
119,2017,5,30,石洋磊,2,婷酱er,113251385
120,2017,5,17,虽然我最爱燕姿，但这歌是张惠妹的呀！,0,孽愆愆,3068164
121,2017,5,16,想起你的时候，我会在办公室哼上一句。,0,longlongAha,276353473
122,2017,5,13,明明是张惠妹,0,real拆弹专家,258291210
123,2017,5,12,都怪我太不争气 ,0,就是小天使,343591165
124,2017,5,9,hhh扎心了,0,来水星,272555843
125,2017,5,7,钢琴伴奏啊啊啊天后的嗓音啊啊啊哪样不是最佳？,1,吃西瓜的人会瘦啊,56316351
126,2017,5,5,我们这边泪点都是戳的诶。,0,与你重温-,112825540
127,2017,4,27,都怪我太不争气，这句真的搓到泪点了,1,苗培文,266224265
128,2017,4,25,爱有多伟大就有多卑微了,0,乐乐乐乐cui,348926642
129,2017,4,25,玛德…这话太心酸了…,0,着迷于你眼睛___,35606799
130,2017,4,20,不能放纵爱你 就放过自己,1,你为什么不吃肉,109958184
131,2017,4,15,内心好纠结的一段话,2,心烦意乱啊,2625826
132,2017,4,6,我恨我爱你 只是因为你是你[流感],0,沫沫1212,349324801
133,2017,4,5,我恨我爱你,0,熙妍阿洁,123815224
134,2017,3,31,太好听了   第一次是听到陈奕迅的翻唱  偶尔间 翻到孙燕姿 原唱   太好听了[色],0,PJ彭胡劲弦,277806951
135,2017,3,23,要有多深刻的经历，才能体会那一句【只是因为你是你】,2,就是那个谁那谁,9754479
136,2017,3,19,《七月与安生》：“我恨过你 但我也只有你” ​​​,8,我说明天是一个大晴天呢,276410635
137,2017,3,17, 这么好听居然没999,3,局外人gsy,287214378
138,2017,3,14,没关系,0,eye033,117040633
139,2017,2,27,我恨我爱你,1,张山炮V,296061462
140,2017,2,25,好听,1,斜啪啪菊花,107583137
141,2017,2,25,我 爱 你 生日快乐,1,你又在哪呢,18924721
142,2017,2,19,没人知道分手那一刻我心里的感觉，和难受[便便]当认清自己有多爱他，不能离开他时，已经来不及了。哈哈哈后面才发现，我也死不了,3,_Nursiya,98894382
143,2017,2,15,这个年龄了还是被一首歌打动，一句词戳中……不知道算是纯情还是SB,3,morphineblue,115875162
144,2017,2,14,路边看到广告牌就来听了,0,IV十一,77708585
145,2017,2,7,嘴上说着我最酷 你不来找我我就不找你了  可是当你有了新恋情 总计抑制不住的想你 忘记自己想要做的事情 在想放空自己   我要怎么忘记你 ,1,miszh,129435723
146,2017,2,5,小伤而已。我又没有可怜兮兮。挺恨自己的，爱你的自己,0,咖啡里的茶茶,107723107
147,2017,2,5,我恨我爱你,0,夏在景啊,295828375
148,2017,1,31,丁子期[可爱],0,SANDARA777,292960194
149,2017,1,18,等我啊,0,_FRozen丶,53012671
150,2017,1,14,我恨你最后那一句对不起,0,Annabellesbaby,328732985
151,2017,1,13,I hate that I want u. U want her U need her and I will never be her ,3,BigRyant,249617999
152,2017,1,9,-  我爱我恨你.,1,莉琴妄詡,278524697
153,2017,1,8,我记得蔡依林也唱了这首歌,2,如鱼饮水z,290977583
154,2017,1,6,唐炜麒,0,snowyChanc,247100573
155,2016,12,30,这歌听的[心碎],0,瞿小孩同学91,112866936
156,2016,12,21,网上没有，只有那么一小段视频,0,帐号已注销,58361163
157,2016,12,20,我恨我爱你…那么脆弱的我却那么勇敢的爱着没出息的你 连面对我都没有勇气的胆小鬼 只会逃避我的胆小鬼…,0,乐乐乐乐cui,348926642
158,2016,12,20,你别皱眉 我走就好 …我不烦你 放不过自己但我求求自己放过你…,2,乐乐乐乐cui,348926642
159,2016,12,19,Hate that I love you ,1,猫的娃哈哈呀,122372809
160,2016,12,18,真的是一点小伤吗？,1,帐号已注销,124859943
161,2016,12,14,听天由命,0,KimmmIi,312320671
162,2016,12,10,为什么评论这么少？这么经典的歌,2,芒果芒果狸,91184570
163,2016,12,8,爱不爱我已经没关系 一点小伤而已,1,吃金多虾,85905782
164,2016,12,7,I hate that I love you.,0,果味甜心兔,336288068
165,2016,12,6,我恨你爱他,0,不二六年,273898442
166,2016,12,2,居然没上999？供一票,2,onlytime_sco,343892671
167,2016,11,26,太好听了,0,Berialmiao,108031890
168,2016,11,22,我恨我爱你py,2,SunYanZl,305572811
169,2016,11,20,一个人听来的,1,啥时候才能到十级,300751055
170,2016,11,20,三个不同版本三种不同的感觉,0,尤丽吐孜_yultuz,71533744
171,2016,11,20,你为什么要骗我说你是单身呢？看我飞蛾扑火，自取灭亡，你很开心吗？,0,云之与谁,258780381
172,2016,11,9,奔音质来的,2,wwhad,52093718
173,2016,10,26,2her是她俩的精选集,1,a5da,247447250
174,2016,10,24,我恨你 可是我恨你 就是我爱你。,1,VSAudrey,119426624
175,2016,10,23,放过自己,0,小小小小丸子罒3罒,61861233
176,2016,10,11,第一次听是陈胖子翻唱的,2,starrylee,29431936
177,2016,10,10,只是因为是你 ,1,ZYPING邦妮,125140707
178,2016,10,10,加油啊,0,麋鹿小姐she,62413291
179,2016,9,29,时间长了就出来了,0,花嘟拔得鸟,124857658
180,2016,9,27,还有多久能走出来，好恨,0,maxAz-,105439748
181,2016,9,25,我恨 爱过你,2,-Leciel,126548090
182,2016,9,18,为什么阿妹的在燕姿那里？害我以为燕姿也唱,1,白搭DJ蔡徐坤,260667113
183,2016,9,13,么哒,0,-Flora喵,109946230
184,2016,9,10,我真的后悔。很后悔。爱你那么多年。得到的结果却是那么可悲。为何自己没那么早的看清楚。,2,i丁是个纹身师,267723830
185,2016,9,9,我恨我爱你，因为我真的真的真的本不该爱你，因为的因为真的太多，可是我又真的真的真的想爱你。你似我握在手里的冰，不知所措不知该握紧握松，冻到痛也舍不得放开一秒，因为心里太清楚，我和你在一起的时间有限，太有限。我恨。,3,DRUGJ,266163879
186,2016,9,5,每次发现这种好听但评论少的歌，就好像捡到宝了一样[亲亲],5,Mysaaaaa,89983644
187,2016,8,28,分开都两个月了，还是恨不起来。,0,驯鹿讨厌来雪山打球,305665993
188,2016,8,27,我可以一个人安静的忘记你,0,jin_hw,18147215
189,2016,8,26,真的吗,0,乐中作乐,319968689
190,2016,8,23,告白也只能做朋友,1,不脱袜,299127489
191,2016,8,18,告白的时候就知道不能做朋友,3,366天都困,100538099
192,2016,8,15,有没有哪个小孩知道 哪里能找到林宥嘉翻唱的版本[呆][呆][呆] 跪谢[吐舌],2,刺儿颖,250533727
193,2016,8,13,没有999是很奇怪,4,瞳孔老化,133781194
194,2016,8,12,等我五年，我给你一辈子,2,suby杨琳,284188063
195,2016,8,12,分开第五天。愿我们都好好过。爱情最终抵不过时间么。不甘心又如何。我知道，这次我们都不会低头。我们本不该在一起。八年而已。只是八年。如何轻易放下、,3,小简单的,309737943
196,2016,8,11,心里也很矛盾怎么办,0,旅馆和猫,132908445
197,2016,8,11,爱情里的不公平到了无法容忍的地步 也就变了质 so  just follow your heart,1,李逍遥公子师父,3836344
198,2016,8,11,我恨我自己 不后悔爱你 🙏,1,Yangoon,49777564
199,2016,8,10,别难过 摸摸头,0,小星星啊小星星,128490288
200,2016,8,10,我也想问,0,旅馆和猫,132908445
201,2016,8,10,分手第六天 你以后都不会来找我了对不对,2,nuonuoyou,76816311
202,2016,8,10,我恨我爱你，我也恨你爱我，才无法抽身。感情未满。,1,温孤嘲风,90959499
203,2016,8,10,我恨我爱你，我爱你与你无关,0,谁管你开不开花低到尘埃里,275250359
204,2016,8,10,我爱你，只是因为你是你,0,往昔碎碎念念,288126463
205,2016,8,10,一点小伤而已,2,林垚Twice,86630351
206,2016,8,10, [爱心][爱心][爱心],0,kkkklauzz,135889705
207,2016,8,10,一点小伤而已[可爱],1,-Leciel,126548090
208,2016,8,10,我也恨我爱你,0,大点声我听不见啊,124624547
209,2016,8,10,若人生每天都只若初见 你站着不说话 看着我 风吹过这种感觉就很美好,1,咚冬卷,38660347
210,2016,8,10,这首歌没有999不科学  🙊,5,季明曦丶,1152358
211,2016,8,10,我恨你离开我，明明都很爱。可我爱你，你让我又爱又恨。我恨我爱你，我爱我不恨你。,0,左大太阳,272375697
212,2016,8,9,没有999不科学[哀伤],0,Echo阿星,124773919
213,2016,8,9,[亲亲][亲亲][亲亲],0,_kagura,50541366
214,2016,8,9,爱情已经过了甜蜜期，多说也是无益,4,帐号已注销,267687796
215,2016,8,5,又爱又狠,0,么绪,49740703
216,2016,8,1,最后一张王牌在手里，二选一的几率。,2,基于两种立场我会罩着祢,63187073
217,2016,7,30,如果有一天，爱变成了谦卑，我们的爱还有意义吗？,1,李逍遥公子师父,3836344
218,2016,7,25,Eason唱的也很好听,0,小螺号滴哩哩,305678072
219,2016,7,23,这张专是收录的 找999出门右转,0,-Solace-,91592606
220,2016,7,17,可能是先入为主，更喜欢蔡依林的版本,4,呆了枝头,97640350
221,2016,7,9,一听就会循环，可能是因为真的唱到心里了吧,5,Smile大猫儿,88019238
222,2016,7,6,这个歌没人评论？,1,所以就不爱軟了吗,263338269
223,2016,7,5,这个居然没评论？,1,雷锋哥哥哥哥哥,1742871
224,2016,6,11,居然没999,2,1028129,267112089
225,2016,6,10,最后一张王牌呵呵……,1,K一本正经K胡说八道K,253098612
226,2016,6,4,竟然不是999＋不科学,2,不愿意透露姓名的陈姓键盘手,252231669
227,2016,6,1,换个思路回想过去自己犯的错误对于他她的伤害，别嘴硬说没有，也别不承认自己的那些不好，去找他她当面道歉之后就更容易放下,1,安国李荣浩,45775599
228,2016,5,30,我一直看不懂封面图的意义，虽然看了好多好多次了,5,帐号已注销,65718996
229,2016,5,30,嗯。单曲循环中。最近真的是不知道怎么了，伤感到不行。,1,须臾chenchen,88879658
230,2016,5,28,太固执，放不下，回不去，让我感到绝望,2,哈哈哈嘻嘻嘻o,75938559
231,2016,5,26,呵呵呵，想把你屏蔽千百次🙃🙃🙃,2,一麻袋的爱成患病病友,42242438
232,2016,5,25,跟我回家好不好[呆],2,如果你很冷,120738148
233,2016,5,23,我恨我爱你 可是又有什么用 你注定在我生命里走过 最后只剩下我一个人在回忆 你终究会离开去过你自己的生活 只有我 还活在我们的回忆里 独自伤悲,2,Mrs庚庚庚心,92028608
234,2016,5,23,[钟情][钟情][钟情],1,猪粉啊,134094435
235,2016,5,20,听到有人唱这首，歌依旧好听 唱歌的人却觉得什么都唱错。,1,梦想做只考拉吖,79560220
236,2016,5,20,今天听蛮好,1,Ershouyann,65890881
237,2016,5,19,突然就翻到这首歌了，记得3年前和初恋分手，听这首哭得死去活来,1,科研组组长,110859094
238,2016,5,16,我不会为了留你假装可怜兮兮 都怪我太不争气,2,Mrs庚庚庚心,92028608
239,2016,5,15,无意间听到的 歌词很好啊,1,Rap小王子_,257615238
240,2016,5,8,"真的很好听。我恨你最后那一句



我爱你",1,帐号已注销,107335559
241,2016,4,30,面带微笑离开你怀里，想你,4,豆侠哼,259672173
242,2016,4,25,网易评论的好处在于，评论完之后就找不到自己的评论了，只有当别人给你点赞的时候，你才会突然想起当时听这首歌的心情,8,牛哥不爱你,112417384
243,2016,4,25,阿妹的歌居然也有这么少评论的[惊恐],3,牛哥不爱你,112417384
244,2016,4,18,如此让人热血沸腾的温度。中午好新泽西。,1,margaretlan,83410163
245,2016,4,18,吵架后，听见男友听着这首歌，在旁让气氛慢慢宁静下来的我，听了他重复第二遍时，就问及什么歌名。。。最后我们都凝望着彼此的时候他对我说“妳知不知道我很爱妳？” 到今天早上我还记得他说这句话时的认真。谢谢你，谢谢你那么爱我。,3,琥珀色德蘭,40729634
246,2016,4,12,才发现阿妹声音好好听,1,雨伞酱_,75139757
247,2016,3,27,我恨我爱你，可还是爱你,3,小叶叶的喵,44830059
248,2016,3,26,我有你拿也拿不走的旧回忆,1,笑忘书June,74214654
249,2016,3,22,爱不爱我已经没关系,2,由唱到听,117439976
250,2016,3,16,败给了时光的腐朽 ，败给了自以为是的长久 ，粉身碎骨落成尘埃里的泡沫 ，别要求太多 ，我们能走到哪是哪， 合则聚不合则散 ，我不是很好的人 ，来路归路， 可能都是独身一人。,2,姚姚的音乐空间,118903826
251,2016,3,16,只有我不那么喜欢阿妹的声音吗,1,cccmcm,73371709
252,2016,3,12,我恨你最後那一句 我愛你,1,2012218Spence,89513347
253,2016,3,8,那我认真听听,2,蔡风见,77945895
254,2016,3,8,@蔡风见 如果以后分开了，这就是告白,1,JansVibe,40168524
255,2016,3,3,评论这么少，不科学诶.....,1,Avatar_52,9483787
256,2016,3,1,你的眼里 有最甜美的温柔 也有最刺骨的冷漠,3,扁食拌面,88925029
257,2016,2,29,晚安曲[爱心][爱心][爱心],1,说的跟闹着玩儿是的,2624192
258,2016,2,26,"爱情已经过了甜蜜期
多说也是无益
只怪自己还爱你！
",1,Tech_yu,80996625
259,2016,2,19,好好听，哭了好久,1,石川羽田,136019100
260,2016,2,19,除了逃避，我还会做什么,1,平平在听呢,100165622
261,2016,2,18,我爱你 我爱你 我爱你,1,帐号已注销,113629168
262,2016,2,15,任何翻唱都不如阿妹的伤,1,ThetHtar,88757988
263,2016,2,13,听我唱[憨笑],1,郑好灿,51776997
264,2016,1,27,我恨我爱你,2,温姓少年,68295967
265,2016,1,26,好听[吐舌],1,洋洋1412,125870471
266,2016,1,21,为什么评论这么少,1,钟爱EASON的女娃娃,72629796
267,2016,1,3,和我高中同桌唱的差不多，也就听了100多遍吧,3,CR7alien,41333550
268,2016,1,3,第一次听这版本,1,夜礼服假面t,75078055
269,2016,1,2,喜欢Eason翻唱的,2,靠譜的老男人,76820456
270,2015,12,24,任何翻唱都不够这个味道呀～,2,Acicistar,68134383
271,2015,12,20,我不会为了留你假装可怜兮兮,1,邹濃,111118457
272,2015,12,17,我爱你啊…[流泪]想起的全是你,3,鸡蛋黄-,73721485
273,2015,12,16,都怪我太不争气,1,王牌神棍黄哈戳,52754927
274,2015,12,8,这不科学啊！评论这么少？[爱心][爱心][爱心],2,zhxjuan,15442546
275,2015,11,24,[流感],1,一位骨骼惊奇的女子,73978150
276,2015,11,5,爱恨永远一念之间，不过在爱情当中，往往是恨你没有爱我多一点，不管是相比TA，还是相比以前,3,Arburt,10135764
277,2015,10,15,你有多少段新恋情都没关系  我爱你,1,渥太华88,91885173
278,2015,9,7,最近吃得太多，又发胖了，down，[呆],2,Monie77,58272867
279,2015,8,23,爱到不行，这首歌AMei被的演绎得细腻而精准。,7,Matt_Shaw,10231746
280,2015,7,29,爱不爱我已经没关系,1,我是徐若瑄,54375711
281,2015,7,23,不能再好听～,2,十字路口等绿灯时不小心忘了路,75684468
282,2015,7,12,"沙发
",1,Always_comingback,46566168
