index,year,month,day,content,likecount,nickname,user_id
1,2019,11,24,"让我看到一失恋女孩，把往日的痛苦伤感写成诗，轻轻哼唱，放下过去走出低谷。
也是完美的一天哦",0,Gladiator_q,120411964
2,2019,11,20,[口罩][口罩]对我的上条评论斧正，“字不醉人人自醉，你的品味总是美”，其实是出自水浒传中。具体是哪句我不记得了,1,奶心爸妈巧心结,437506782
3,2019,11,7,无路可退，只能无言以对,1,isNn丶,362158056
4,2019,11,7,是Jay演唱会翻唱啦~,0,isNn丶,362158056
5,2019,11,7,为何一听这首歌曲就会联想到很多伤心往事。,0,霹克,481252728
6,2019,10,30,我来组成评论,0,西兰花伶人,257332185
7,2019,10,29,因为回忆总是美,0,你听不到你听不到,627844123
8,2019,10,29,19.10.29回来听,1,ZY-7,17531038
9,2019,10,24,今天确实挺凉的😔,0,走召Vanilla_x,424525967
10,2019,10,21,哈哈  好想算了,0,风衣syz,619438249
11,2019,10,17,送你上去,0,_--宁缺毋滥--_,1578126505
12,2019,10,15,我昨天看到一句话，作为姿迷的我随即想到了这首林夕写的歌，原诗是黄增写的，此两句为“色不迷人人自迷，情人眼里出西施”。林夕巧妙的改写成了“字不醉人人自醉，你的品味总是美”。这文字功底真是达到了登峰造极的境界。,4,奶心爸妈巧心结,437506782
13,2019,10,15,我昨天看到一句话，然后就想起了这首林夕写的歌。原诗是黄增所写。此句为“色不迷人人自迷，情人眼里出西施”看来林夕的文学功底真的是到了曾峰造极的地步了，我却只能借用林夕所写“字不醉人人自醉”。,0,奶心爸妈巧心结,437506782
14,2019,10,12,评论这么少不科学,1,sunjiahang,375838001
15,2019,10,8,分手伤了谁，谁把它变美，我的眼泪写成了诗已无所谓。,0,上山打个铁,286462227
16,2019,10,6,忽然发现孙燕姿唱歌的普通话里有平卷舌～真好～,0,Pamgu0419,114014486
17,2019,10,4,我一直以为这首歌 原唱是 周杰伦,0,叮当猫的麦兜,1726957891
18,2019,10,3,三寸天堂原曲不是日本歌曲么,0,天空vz,256167033
19,2019,9,29,人自醉,0,大红红蝴蝶公主的手下,645714903
20,2019,9,22,第一次听是河南电视台的晓华探案,0,心若向吴,1438247144
21,2019,9,20,害！真好听！[吐舌],0,也不是猪只打呼,355734135
22,2019,9,16,吻别听一下,0,白猫橘子,53722493
23,2019,9,15,2020演唱会真的是很想去希望有这个机会吧,5,甜甜辣辣就是我,475642194
24,2019,9,7,第一季，好像在前几集里面,0,快送我出家,302527318
25,2019,9,7,那一季那一集？？？？,0,梦-老特拉福德,105580861
26,2019,9,7,最爱的几首燕姿,0,洛丹伦的小天天,1868167639
27,2019,8,28,字不醉人人自醉 [流泪]仿佛 回到那2005 19 岁 我第一个深爱的女子 可是只是苦苦的暗恋 那两个孩子的妈 你 还好吗 忆起 眼泪已成诗！[大哭],1,山林雅士,289125011
28,2019,8,27,爱情公寓里吕子乔唱了这首歌。。,1,快送我出家,302527318
29,2019,8,23,姿不醉人人自醉,5,苑子潯的小号,1548957065
30,2019,8,23,梁伟文,0,尹天仇vi,1287554968
31,2019,8,21,听这首歌 真的就是眼泪成诗,0,唉哟唉哟唉哟唉哟,284461673
32,2019,8,20,看了杰伦的live版来的，很感动！😊,1,冷漠的夜猫,452775494
33,2019,8,20,先把主谓宾搞清楚吧,0,又起名字好烦呐,437266634
34,2019,8,19,其实我一直认为，距离不是造成分手的原因，距离是放大你们之间问题的媒介而已。,0,航天城拖地的,80582726
35,2019,8,17,对✓,0,不吃甜的铭懿,364398185
36,2019,8,17,想到了爱情公寓 大家以为吕子乔抑郁 因为他在纸条上抄了孙燕姿的歌词,2,胖球i,491907171
37,2019,8,12,因为孙燕姿曾说她自己也不懂这首歌的歌词在说什么[大哭],0,-Spring-_,94346633
38,2019,3,18,三寸天堂不是本身有抄袭嫌疑么？当时还弄得轰轰烈烈呢,3,wzmcjianyan,1342236900
39,2019,3,15,写步步惊心那个人好像是抄袭专业户，给李宇春写的歌也是抄的,7,彼得潘与狼,261245021
40,2019,2,18,三寸天堂前奏就是抄袭这段的吧,37,我是青萝呀,445649056
41,2019,7,31,都快忘记了，小时候听过最多的是孙燕姿的歌啊,1,今晚或许会有星星吧,291670599
42,2019,7,29,《眼泪成诗》孙燕姿与作词人林夕首度合作。古典加爵士，配器结合钢琴与二胡，那几声二胡，揪着人心。,2,识刀客,623315109
43,2019,7,29,不用一直，因为总有一天你们之间的感情会消磨殆尽,0,我曾难自拔于世界之_大,420399755
44,2019,7,28,我很想念你  你呢 可不可以想一下我 一点点也行,2,lesucre--,272534319
45,2019,7,27,不该,0,星5晕了,547623650
46,2019,7,27,如果一个男生一直会让你流泪伤心 但我却很爱他 我是否应该和他一直在一起,3,祁谖爸爸,573166880
47,2019,7,24,我姿[亲亲][亲亲][亲亲],0,孙燕姿的粉丝,36733053
48,2019,7,23,我的ipod里一直都是“遇见”“同类 ”“眼泪成诗” “雨天” “隐形人”循环播放，心里抹不去的，时不时会出来蹦跶一下,2,finalfestive,7060220
49,2019,7,15,我永远喜欢孙燕姿,2,_____天青色,576308209
50,2019,7,14,回忆总是美......,0,霉头霉脑云散月现自在飞花slay,42294326
51,2019,7,13,卡,0,Chertime,83946830
52,2019,7,11,怨妇型情歌还是让别人唱吧，不适合燕姿。这么多年过去了，循环到会唱但还是不适应这首，包括不局限于新专的充氧期。,1,O_oHULLO,343829645
53,2019,7,11,一开始还以为是三寸天堂来着  等孙燕姿的声音一出来 才知道不是哈哈哈哈,0,春未了月相照_yu,435867533
54,2019,7,11,我也是……[多多捂脸],0,春未了月相照_yu,435867533
55,2019,7,11,前奏的二胡一下子就吸引到我了,0,听歌使我快乐喔,399543214
56,2019,7,10,我喜欢孙燕姿，并且尊敬这样的人。这首歌是发现杰伦之前演唱会唱给台下的燕姿，然后找过来听。,0,excellent_bug,579431740
57,2019,7,10,这首歌2005发布，三寸天堂2011发布,1,JEan-ak,1494121306
58,2019,7,9,@韩昕贝 ,0,橘子汽水Ame,73595235
59,2019,7,8,杰伦唱的也不错,1,李赫男的小宝贝,271071210
60,2019,7,8,最可悲和最可笑的事，就是你用力保护 用心经营的爱情，最后是 前人种树后人乘凉……,1,林胖六,427229832
61,2019,7,7,林夕的词真的是没谁了 ,0,Hongege丶,125195298
62,2019,6,30,谢谢,0,zyc唐宋元明清,633752187
63,2019,6,30,那是，仙女评论必须回复,0,zyc唐宋元明清,633752187
64,2019,6,29,头一次见到承认的[呆]其它人盗了上热评后直接装死,2,苜蒲,1476249050
65,2019,6,29,哈哈哈哈哈哈哈你好可爱,0,苜蒲,1476249050
66,2019,6,29,林夕太可怕了，眼泪控制师,1,定在原地就困着等啊,549858601
67,2019,6,28,高中晚自习听着耳机的日子是那么美好,0,miga107,7124450
68,2019,6,28,姿不醉人，人自醉,1,飞机场de十点半,46177241
69,2019,6,26,我也刚看到诶 就过来听了,0,一起来砍刘星宇,305085025
70,2019,6,24,一年又一年 一月又一月 一天又一天 也许哪天我就撑不下去了 亲爱的们到了那一天 你们不要怪我呀 我真的累了,1,倔强蘑菇,443110054
71,2019,6,22,有时候听它是为了疗伤，却控制不住自己变得更加悲伤。走不出来，也走不进去。,2,mosstr,297667922
72,2019,6,20,他们说少女情怀总是诗，我大概快没了这种情怀,4,这里是哪个呀,302550357
73,2019,6,11,不了解二胡...但是三寸天堂这样算不算抄袭啊...,3,H-Scorpio,34795379
74,2019,6,11,唉，在这把你活捉了,0,古树地界,1591717720
75,2019,6,10,"有些人，只能陪你半生
",0,收集注销_收藏故事,1482537933
76,2019,6,10,初恋就是这样被我甩掉的。总觉得自己不够美好，不够瘦，不够白，不够漂亮。觉得配不上他！像躲起来把自己变得美好再去爱他，结果伤害了他。到现在他都觉得是我狠心甩了他！,0,你喜欢下雨天吗1991,509902895
77,2019,6,10,回头想想，其实并没有真正的爱过谁！也没被谁真正的捧在手心里爱过。小心翼翼的活着，连自己都不爱，怎么爱别人？又怎么被人爱？,3,你喜欢下雨天吗1991,509902895
78,2019,6,4,嗯嗯对 后来她解释这是最难唱的 她总觉得可以更好,1,Sparrrrk,270935914
79,2019,6,4,哈哈哈[开心]我是觉得这首歌不适合她唱,0,十四阿七,106519156
80,2019,6,4,孙燕姿在康熙来了接受采访的时候说这是她觉得她这张专辑里最难听的哈哈哈哈,3,Sparrrrk,270935914
81,2019,6,2,我姿也有欢快的歌呀，你应该听《超快感》！,0,孙燕姿best,46251605
82,2019,6,2,当时手机里就是孙燕姿的歌😂,0,小小江山-,506013203
83,2019,6,1,“因为不配 你就忽然自卑说声失陪”听到这句真的感触蛮深 有很多感情 不管是友情还是爱情 都因为我的自卑而草草收场 现在想来 真是蠢啊 但是重来一次的话 我应该还会那么做吧,2,爱吃恐龙的翎子酱,406104376
84,2019,5,31,原来这就是吕小布说的歌词,6,JustTyler,396005809
85,2019,5,30,字不醉人人自醉，你的品味总是美,2,愿君依旧笑,559237310
86,2019,5,27,唉吗,0,超神v8瘗奊大8o,606986339
87,2019,5,24,那只是你的感觉而已  我不但觉得很搭  而且完美,0,林如铁,283607468
88,2019,5,17,我的眼泪写成了诗已是无所谓,1,来去无有,73702105
89,2019,5,15,哈哈哈,0,脏袜子Pu,319696717
90,2019,5,11,当初该找你写这歌？,2,晒红的一双耳朵,1787663836
91,2019,5,11,刚听啦翻唱，赶紧听原唱洗洗耳朵,0,晒红的一双耳朵,1787663836
92,2019,5,11,没关系，我有钱我想晚点死行吗？[呲牙]我现在每天活着都很开心就喜欢你这种的哈哈哈哈,1,zyc唐宋元明清,633752187
93,2019,5,10,嗯，来了,0,得布西森林,95937066
94,2019,5,8,三寸天堂,2,听雨蒙僧衲,1362723316
95,2019,5,7,我见过你爱我的样子  所以我确定你是不爱我了,2,一米九萝莉-,515159975
96,2019,5,7,玫瑰她又想动她的短发，可是应该吗。,1,cinder-Cendrillon,1306120339
97,2019,5,7,玫瑰她又想动她头发，可是应该吗。,1,cinder-Cendrillon,1306120339
98,2019,5,6,"我见过那么多的花，
就只把你采下来了，
结果你还枯萎了，
不知好歹的东西",2,像太阳一样的人儿,444159242
99,2019,5,6,我一想到你我就想哭，我想见你。,5,NNZ蜡笔小新,343175738
100,2019,5,6,我想你了，不知道你那里下雨了吗？有没有想我，，，，,3,Pluto沫,478501475
101,2019,5,6,你去姥姥家就不能听点欢快点的歌么[大哭],0,孙燕姿best,46251605
102,2019,5,5,哈哈哈你好可爱,3,假意情郎,1500684248
103,2019,5,5,加油,0,柠九青,1594706296
104,2019,5,5,美术嘛，我是美术生。你要好好加油咯，文化课也不能放松咯，小学弟加油呐[多多比耶],0,辜负丶180107,1334567772
105,2019,5,5,对呀[呲牙],0,辜负丶180107,1334567772
106,2019,5,5,如果能回炉重造就好了,1,布鲁斯船长,455944352
107,2019,5,5,我也是艺术生，现在在集训，一起加油,0,午睡会想,1821289170
108,2019,5,5,艺术生吗  加油呀,1,城北南城H,1324315209
109,2019,5,5,马上就高考了，网易云也七级了，充个黑胶，加油加油，文化课一定要过呐[多多调皮],1,辜负丶180107,1334567772
110,2019,5,5,这首歌好美,0,awakemountains,517719016
111,2019,5,5,留名.,1,舜书,1703452959
112,2019,5,5,找到你了,0,陈先生你怎么了-,645041277
113,2019,5,5,当年看昆仑的时候我还是初中，我还记得那本武侠小说封面是绿色的里头还连载了好几个故事，一转眼我都大学了哈哈,0,Cheelry,611373822
114,2019,5,5,好,0,胖老夫子,1666297398
115,2019,5,5,2020年！,2,H-S_Sun,296312220
116,2019,5,5,哈哈哈哈哈哈哈作为姿迷看到那一集巨激动,1,H-S_Sun,296312220
117,2019,5,5,让我想起了《晓华探案》,3,Chafferer淼淼,371979651
118,2019,5,5,这首歌第一时间让我想到了 爱情公寓,4,一只仙juju,1459895099
119,2019,5,4,中间的旋律太美了,1,喜欢我的小太阳,425119502
120,2019,5,4,你不是一个人！,1,兰溪山人,1568686779
121,2019,5,4,分手伤了谁，伤了拥抱着爱情的❤️。,3,花开遇见幸福,1310736175
122,2019,4,28,每次听这首歌都想起来高中放学骑自行车去姥姥家的样子，一路上单曲循环的就是这首歌,1,小小江山-,506013203
123,2019,4,28,孙燕姿的歌，听的都是回忆。😭,1,小小江山-,506013203
124,2019,4,26,当年QQ空间背景音乐就是这首[吐舌],2,孙燕姿best,46251605
125,2019,4,24,这张专辑刚发行的时候我听这首歌感觉很奇怪，词是悲伤的，为什么却又那么多细节和原因，感觉不通。后来燕姿在节目里说这首歌是女主被男主甩了，一时难以接受，所以就幻想是男主以种种原因离开了自己，总之是他不配，不是自己的原因。后来再听这首歌，简直有一种斯德哥尔摩的魔性！半醉半疯！[钟情],6,小吉鸡,42993681
126,2019,4,23,放手如同拔牙拔掉的那一刻，你会觉得解脱。但是舌头总会不由自主，往那个空空的牙洞里舔一天数次，不痛了不代表你已完全无视留下的那个空缺，永远都在间或甚至异常挂念，适应是需要时间。但牙总是要拔，因为太痛所以终归还是要放手。,4,BeginAgain雨空,77265472
127,2019,4,22,这不是吕子乔的诗么？？[大哭][大哭],6,听歌根本不需要昵称的,1780801803
128,2019,4,21,因为周杰伦演唱会💙,1,热河路发型师胡彦祖,88180955
129,2019,4,18,因为杰伦来的,1,肉丝儿0812,472513560
130,2019,4,14,为什么,0,忍冬疏影,1529341622
131,2019,4,14,我的眼泪泛滥成洪水她也不会回头看我了,0,TricolourLoVe,433451642
132,2019,4,13,当初就不该找林夕,0,O_oHULLO,343829645
133,2019,4,7,听着听着眼泪成了诗,1,孙晓芳牛逼,349360733
134,2019,4,6,诶，听醉廖,0,愿君依旧笑,559237310
135,2019,4,4,"～2006年, MTV频道",0,SolidSnake_,366772150
136,2019,3,20,不管好不好 总之 得之我幸，失之我命,2,外星核反应堆,268608108
137,2019,3,18,三寸天堂不是本身有抄袭嫌疑么？当时还弄得轰轰烈烈呢,3,wzmcjianyan,1342236900
138,2019,3,15,写步步惊心那个人好像是抄袭专业户，给李宇春写的歌也是抄的,7,彼得潘与狼,261245021
139,2019,3,9,眼泪成诗,0,想好没啥叫,1778772976
140,2019,3,8,是的！！,1,不会开花的姜,380647733
141,2019,3,4,周杰伦写的那首是眼泪知道[口罩][口罩],0,Ring------,47442636
142,2019,3,1,不是周，siesie[憨笑],0,H_Stef,309880055
143,2019,2,18,"眼泪成诗
多美也感动不了你",1,甜菜菜C,90195065
144,2019,2,18,三寸天堂前奏就是抄袭这段的吧,37,我是青萝呀,445649056
145,2019,2,12,厉害了,0,夜深了_找那个星星,406570666
146,2019,2,10,低调低调,0,zyc唐宋元明清,633752187
147,2019,2,10,是的,0,一只大碗子CCchloe,440451553
148,2019,2,10,真的吗？,1,夜深了_找那个星星,406570666
149,2019,2,10,听过三寸天堂，又听了这首眼泪成诗，眼角本来只是湿湿的。，结果为什么我会感觉心里闷闷的！   希望这种感觉，大家永远都不用体会,2,宇宙联合会驻地大使,111662375
150,2019,2,9,第一次见到活的热评……,5,椥裕,83021924
151,2019,2,9,说实话，不是我，我是盗版,3,zyc唐宋元明清,633752187
152,2019,2,9,这评论我不止一次看到了，我只想知道那一个是原创,3,江哥家的淇儿,1436672068
153,2019,2,7,可是她现在有对象了[哀伤],9,zyc唐宋元明清,633752187
154,2019,2,2,因为不配,1,灏真,337866205
155,2019,1,30,因为回忆总是美……,2,小米糕啊,1436371488
156,2019,1,29,初见时惊鸿一瞥,0,_反正最后每个人都孤独,345444394
157,2019,1,27,晓华探案,0,生命啊它就是一个月台,126781365
158,2019,1,24,相恋纵使隔着千山万水，也终会跋山涉水相聚。,12,源源的老婆,304501709
159,2019,1,21,作词梁伟文，就是林夕大佬,1,天允山不山,72146838
160,2019,1,20,三寸天堂是真的像,1,丹心嫣然,250246964
161,2019,1,20,字不醉人 人自醉,2,麇一怜,290864888
162,2019,1,19,妈呀我也是！！！太像了,6,书中自有颜如玉o,452642316
163,2019,1,15,《眼泪成诗》竟出自《完美的一天》。,5,周大湖,38685879
164,2019,1,14,当年用随身听听这张专辑的时候正在看凤歌的《昆仑》 ，那年我上初中现在我儿子已经可以叫爸爸了，岁月啊,2,丶RustyNail,467651943
165,2019,1,10,刚才在微博上看05年华语单曲榜[流泪]，14年前的事了,0,古德皮剖_,316302809
166,2019,1,6,时间是一种质化绵延状态，而非如流水一样线性流淌，过去的意义之光一直照在当下，旋律响起，十几年前点滴日常、欢乐烦恼依然在面前，燕姿的歌声一直是我的时间中最重要的线索，连接起时间网络中的每一个重要节点，很难想象如果没有燕姿的歌声，时间无序错乱的状况。[多多捂脸],6,城西毛小湖,269213871
167,2019,1,5,好好听,0,Malicee,115018690
168,2019,1,4,[爱心],0,成小姿S,84991554
169,2019,1,2,前奏好听,0,星星不是我的z,1689491767
170,2019,1,2,我的品位才是最美。,0,孙燕姿的小迷妹啊,327977684
171,2018,12,29,❤️,0,你姿我姿,466537747
172,2018,12,28,我一定要去你的演唱会！,3,Museed,30437419
173,2018,12,28,吕子乔装抑郁症的时候用过这个歌词[大哭]，三寸天堂真的很像这首歌，还像日本的梦的点滴,2,沉水碧,305204724
174,2018,12,27,男周女孙啊,0,恶魔么么哒哒,1443777506
175,2018,12,27,06年循环几天，心疼当时18岁的自己,1,明日欢,19435323
176,2018,12,26,2009 年和高中女友分手，一个人在网吧通宵单曲循环了一夜,2,黄花菜凉了__,309352180
177,2018,12,24,燕姿的林夕有种清新脱俗的感觉,1,咕叽咕叽WOTM,364196459
178,2018,12,19,已经把绝情变成了恭维,0,Landung,562248348
179,2018,12,19,我已经,0,Landung,562248348
180,2018,12,18,我最喜欢的人 这辈子都没有理由再见到了,0,Chessya爱小花,1308759582
181,2018,12,10,三千年前,0,吟詩的瑪利亞,556492627
182,2018,12,10,"然后他毫不犹豫的都删了
要走的人
永远留不住
那就放他走吧",1,彩阿彩cc,1648813462
183,2018,12,10,"“初雪的时候你会回到我身边吗?”
“你还回来吗”
他说：“不”
“那你把我QQ微信都删了吧，我不想再控制不住自己找你
要走就决绝一点
我不想我的挽留和珍惜在你眼里只是卑微”",3,彩阿彩cc,1648813462
184,2018,12,7,多少次的不挽留，多少次的转身，多少次的回眸，多少次的泪流成河。。。我已经不流泪了，因为为了你我已经没有了眼泪,1,秋裤在哪呢,1676251785
185,2018,12,2,分手伤了谁,0,小爺180126,573689298
186,2018,12,2,不看,0,永远爱贾隆平,423398340
187,2018,12,1,你怎么知道的,0,永远爱贾隆平,423398340
188,2018,12,1,一别两宽，各自安好。,0,帐号已注销,310866648
189,2018,12,1,林夕写的歌总是透露着他喜欢男人的蛛丝马迹,0,咕叽咕叽WOTM,364196459
190,2018,12,1,真若眼泪成诗，一切便以成为历史……,0,LOVEDracula,125795269
191,2018,11,30,对的,0,CINDYCIN,437254772
192,2018,11,29,想起了高三自习时和同桌一起听孙燕姿的日子,0,vv要加油吖,1510942162
193,2018,11,27,开哥是谁？,0,迅哥_我是猹,315736978
194,2018,11,27,以前过年串亲戚时在一个小姑姑家的电脑上听了这首歌。有手机后，这首歌很快就被留在歌单里了。,0,今萌有圆,1681103469
195,2018,11,24,zyc是我的名字缩写，好巧,0,我是艾克不接客,335012306
196,2018,11,24,啊哈哈哈哈哈 还在首页呀,0,孙燕姿的小迷妹啊,327977684
197,2018,11,22,还有人怀念吗？,0,大禹111,370583260
198,2018,11,13,造化弄人,3,ZZZZZ周周Z,395416209
199,2018,11,12,分手伤了谁，谁把它变美,1,路在脚下f,543788608
200,2018,11,11,顺序搞错了吧,0,ADancingVanGohn,1419781805
201,2018,11,10,是啊，听了好多年了，烂大街就感觉心爱的东西别人拿走用还不珍惜,1,我-饺子-给馅,365497993
202,2018,11,3,"因为不配，我忽然自卑
但失去之后又忽然后悔",3,_Lostars,646936044
203,2018,10,29,好歌不需要烂大街,4,刚好974577,557420917
204,2018,10,27,这首歌每次都能挑起我心里的涟漪,3,G罐头,116698156
205,2018,10,26,超爱孙燕姿的情歌,0,Jake-Anne,104219632
206,2018,10,24,无路可退 只能无言以对,0,孙燕姿的小迷妹啊,327977684
207,2018,10,19,听了那么久才知道这首的作词人们是这群牛人,0,咖啡一杯闷,52291142
208,2018,10,17,"承认吧 ，
你不是萌妹子，
不是女神，
更不是小公主 ，
你只是一个有小脾气，
又有点懒 爱幻想未来的俗姑娘 ​​​​...",7,糖果屋的米拉,502172942
209,2018,10,15,我也是一样的人生多是无奈，我这种心情是：失恋的女人,1,用户1565762831,1565762831
210,2018,10,15,我在听孙燕姿的歌曲《眼泪成诗》,0,用户1565762831,1565762831
211,2018,10,9,希望我伦可以唱完整首眼泪成诗,0,景景景景景-景色分明,304134778
212,2018,10,8,这是我的疗伤曲，你们不可以批评她[哀伤],2,mosstr,297667922
213,2018,10,3,我说最喜欢孙燕姿的《眼泪成诗》，我再也不敢去爱上谁。你说你喜欢孙燕姿的《遇见》，你会一直等我回头看见你。,1,爱吃鱼豆腐的阿飞飞飞,448070752
214,2018,10,2,嗯嗯[可爱],0,得布西森林,95937066
215,2018,10,1,孙燕姿本人这张专辑最不喜欢的歌😂,0,彼得潘与狼,261245021
216,2018,9,30,嘻嘻 我已经造啦,0,林34,400839327
217,2018,9,30,虽然期待他们合作，但这首不是你伦作曲,0,得布西森林,95937066
218,2018,9,29,昨晚又梦见他了，梦里只有欢乐没有矛盾，梦见我们同居了，而现实是已经分开了，难道是现实越残酷梦境越美好吗，,1,庚你一起啦啦啦,1310109691
219,2018,9,27,期待下一次演唱会。。。。,0,Too_姿,30961170
220,2018,9,21,因为当初没有听第一首歌买大房子，所以现在眼泪成诗[流泪],4,别人的奇迹,535965547
221,2018,9,18,[呆][大哭]…sorry 搞错了,0,林34,400839327
222,2018,9,18,不是,0,安東沒尼奧,363538833
223,2018,9,12,林夕词,0,sally雪_,69604505
224,2018,9,11,林夕和燕姿总感觉不搭，林夕那一套于燕姿根本就是晦涩～第二主打存在感不强，还不如老老实实的隐形人～,2,O_oHULLO,343829645
225,2018,9,9,一开始的二胡吸引了我,0,ziyo-_-,64638707
226,2018,9,5,女人哪里能生孩,1,小朋友小姐姐小哥哥,1461404672
227,2018,8,31,无所谓 真的无所谓吗,0,Vlle13,1561991422
228,2018,8,28,我86的，我老婆92的。。当年看这个电视剧。。我就这样告诉她的。。想想回忆总是美。。,0,逝去的记忆盒,572386799
229,2018,8,28,想起周杰伦演唱会的情景了,1,孙燕姿的小迷弟吖,364419601
230,2018,8,22,这个开头注定就能让我红心,1,panghuilvu,132925578
231,2018,8,14,所爱隔山海 山海不可平 ,0,中东石油小表妹,348612357
232,2018,8,7,我滴伦伦的曲诶。配上姿妈的歌声～～,0,林34,400839327
233,2018,8,5,好好听！！！,1,kuai_3,123960182
234,2018,8,3,...🎧,0,_诗芊,81037679
235,2018,7,31,你总是难过是想家，寂寞时想她。,1,What丶Rhythm,528659237
236,2018,7,29,真的是心碎了[心碎],0,太阳很好我不好,262103722
237,2018,7,23,唉！刚刚因为弟弟玩手机把手机摔了。。。很不想因为我的强势左右他们的人生，可是看到他们慢慢长大，成绩又不见起色，就是恨铁不成钢啊！还是想他们还是小屁孩的时候，不用为前途什么的操心。,3,N-H-H,315437521
238,2018,7,22,百万歌词,0,Ivan_520_Rain,1476314472
239,2018,7,19,哎,0,uu5Johnny,262456810
240,2018,7,19,说像三寸天堂的可能都不知道孙燕姿的歌 也不知道孙燕姿 哈哈哈,0,leesolyan,304850838
241,2018,7,19,一生还长，不要自己先否定结局,0,念兮清矣,1314292785
242,2018,7,15,心有点碎，有点醉，有点累,0,踩不动脚踏车,572190156
243,2018,7,14,不明白为什么会在这张专辑里,0,Jumia_,1430399674
244,2018,7,12,所以为什么不一二志愿都报一个城市?我为了跟他在一起可是前几个志愿都是成都,0,狐狐狐糊胡,1301675593
245,2018,7,10,这首歌是2005年的，比那个三寸天堂早５年，而且是林夕作词，不是三寸天堂能比的，希望大家别拿来比较了不是一个档次,7,王开心哇哈哈,295136212
246,2018,7,7,前奏让我想起步步惊心😂,1,suna-_,547728827
247,2018,7,5,谁写的歌词，吕子乔写的小纸条都被抄来当歌唱,0,曦回sama,297340163
248,2018,7,3,这种歌属于经典中的经典，无需评论数量证明，燕姿也不需要,2,Faye忌夢,102767132
249,2018,7,2,这首歌2005发布，三寸天堂2011发布。[可爱],1,1YZYOUNG,1386944755
250,2018,7,1,感觉听起来有点像如果爱忘了,0,谢谢小车车,395041448
251,2018,6,30,为什么不火!,0,二成啊二成,308646222
252,2018,6,27,你照照镜子,0,穿极美风衣在圣所蹦迪,410818538
253,2018,6,24,看看会不会偶遇一只小[猪],2,Czzxxzz,11953671
254,2018,6,21,你的品味总是美,1,岁丨月如歌,69791585
