index,year,month,day,content,likecount,nickname,user_id
1,2015,7,1,我的小时候 吵闹任性时侯我的外婆 总会拿刀捅我,6086,l旋律丶,36964732
2,2013,10,27,Hallo~呆会快点回家，不要着凉。。厚~~~,2588,Fredasyd,1251476
3,2015,2,17,不是忘词，是哭了……,1290,老马891209,51287383
4,2015,2,8,那个不要着凉嚯，真是暖到心…,884,乐高正在飞,45519071
5,2016,4,16,这首歌真的不能看00台北的现场版，每次看到舞台上青涩的燕姿，都会泪流满面，仿佛就看到了那时彷徨的自己。没有任何原因。但是感觉却是真的好幸福，仿佛又回到了那个纯纯傻傻的时代。这就是燕姿带来的精神财富。感谢燕姿。,790,lucklk,47469512
6,2014,12,9,hey hello 待会儿快点回家 不要着凉嚯,697,我要做一瓶晃不走二氧化碳的汽水,189523
7,2015,5,11,我爱上让我奋不顾身的一个人，我以为这就是我所追求的世界。然而，横冲直撞，被误解被骗，是否成人的世界背后总有残缺。,619,花小田要环游世界,63032007
8,2015,6,18,如果戴上耳机就可以什么都听不见/ ,370,落大哄,59564758
9,2015,4,19,燕姿是暖心小天使[爱心],361,stefanie孙燕姿,33052332
10,2016,4,22,男杰伦女燕姿的时代是多么令人怀念！,337,灵狐城小财主,112273310
11,2016,4,23,觉得燕姿有些live甚至比录音棚里的还好听,279,看我可爱咩,65911192
12,2016,11,4,我从未见过我的佬佬，但我这些年只要听到这首歌都会单曲循环好多遍。好羡慕你们都能有位佬佬，也在这祝愿全天下佬佬都能寿比南山，福如东海。,263,Qihao7989,302137525
13,2016,4,24,燕姿催大家回家是十几年的传统了吗,240,麦可罗,9603650
14,2016,4,22,我情绪失控的时候，孤单的时候，眼睛里下雨的时候，都是音乐在陪我啊,196,cathyzxx,51667240
15,2016,1,21,路人十余年，转粉只需这一首。,104,nzxsm,98443664
