index,year,month,day,content,likecount,nickname,user_id
1,2016,2,26,目前坐标新加坡，看见豆瓣上圈出过一个燕姿常去的咖啡馆，想去遇见她，可是，坡县每天都骄阳似火，满眼明晃晃的日光，写作晴天 读作绝望，根本没有出门的欲望。没有阴天没有情怀，从小学听到博士，我已经这么老了,268,恍惚的上帝niko,13156137
2,2015,12,2,整个青春，整个回忆都给这首歌了，那年冬天晚饭后的操场，她说，学会唱，遇见，我就和你好。从此耳机里一直都是遇见，好了五年还是分手了，05到10。我最不想回忆的时光，又是我最想回忆的时光。,147,烈焰花火,7907287
3,2016,1,28,评论不多，感觉像找到了一个自己喜欢却不被人发现的新天地。[憨笑],112,Nineninee,104387641
4,2016,6,8,“ 等你时，世界如同加速镜头，而我如常生活，读书，看报，去超市采买食品，耐心洗净每一件衣物，花很长时间洗澡，扫除。我等着你，等你来见我，然后你离开，我再重复那些等待。等，本是一片虚空，而你硬硬的，是棉花糖里一颗小小的核，这个核使等待不再空茫，枯燥。你捞起了我，就是我的主人。”,75,小蜜罐蚁,53171690
5,2016,2,14,如果在新加坡遇见你，        那么，我会带你去坐全世界最大的摩天轮——Singapore Flyer，        在最高点说出最美的誓言。,66,光影若惜,63239435
